버섯으로 관자 느낌 내는 방법! 새송이버섯간장버터구이 만들기,1인분,15분 이내,아무나,6912734,밑반찬,굽기,일상,새송이버섯%버섯류%2개&버터%기타%30g&어린잎채소%채소류%&간장%기타%1T&맛술%기타%1T&올리고당%기타%1/2T&,버섯의 밑동과 갓을 잘라낸 뒤 3~4등분 한다%자른버섯의 양면에 칼집을 낸다%팬에 버터를 녹인다%버섯을 굽는다%불을 약불로 줄이고 소스를 넣고 졸인다,간편추구형%합리추구형
고기처럼 쫄깃한 밥도둑 반찬 '새송이버섯 간장버터구이'레시피,2인분,10분 이내,아무나,6894323,메인반찬,굽기,일상,새송이 버섯%버섯류%3동&청양고추%채소류%1개&대파%채소류%1/2대&버터%기타%1T&간장%기타%5T&올리고당%기타%2T&다진마늘%기타%1T&참기름%기타%1T&물%기타%2T&,먼저 새송이 버섯 3동은 밑동을 제거하고 일정한 두께로 잘라 줍니다. 대파와 청양고추는 쫑쫑 썰어 줍니다.%간장5T 올리고당2T 물2T 다진마늘1T 참기름1T를 섞어주신뒤 썰어놓은 청양고추 대파를 섞어줍니다.%달궈진 팬에 버터 1스푼 녹여준 뒤 새송이버섯을 앞뒤로 구워 줍니다.%버섯이 쫄깃하게 구워지면 만들어 놓은 양념을 버섯이 자작히 잠기도록 부어 줍니다.약불에서 타지 않게 졸여 주심 끝!%고기처럼 쫄깃한 새송이버섯 간장버터구이 완성입니다!%한개 먹어보니 고소한 버터향에 짭쪼롬한 간장양념이 어우려져 참 맛있어요!밥 한공기 뚝딱 하게 만듭니다^^,간편추구형%합리추구형
즉석 목살 양념구이~ 달큰한 양념소스가 정말 맛있습니다.,2인분,20분 이내,초급,6925795,메인반찬,조림,일상,돼지목살%돼지고기%300g&설탕%기타%1T&간장%기타%1-1/4T&물엿%기타%2T&간마늘%기타%1/2큰술&생강가루%기타%1꼬집&맛술%기타%1T&굴소스%기타%1/2T&후추가루%기타%1꼬집&대파 다진거%기타%1큰술&,페이지속 레시피 동영상 시청과!! 유튜브 구독은 레시피 제작에 커다란 힘이 됩니다!! 즉석양념 재료를 모두 넣고 설탕이 완전히 녹을때 까지 잘 저어주세요.%프라이팬을 충분하게 예열 한 다음 목살을 구워 주세요. 불이 너무 약하면 고기에서 육즙이 다 빠져 나오고 비린내도 날수 있습니다~ 꼭 쎈불에 양면을 구워 주세요. 나중에 양념에 조릴거라 안쪽까지 다 안익어도 됩니다~ 겉면이 노릇해 질때까지만 구워주세요.%목살의 양면이 노룻해지면 양념장을 골고루 끼얹어 주세요.%양념장을 부은 다음 물 20cc 정도를 부어주세요. 양념장을 만드실때 함께 넣어도 상관없습니다.%30초 정도 바글바글 끓여 주다가 불을 완전히 줄이고 고기를 먹기 좋은 크기로 잘라주세요. 불을 안줄이고 자르면 양념장에 수분이 순식간에 증발해 버려서 양념이 타기 시작합니다. 커팅 할때는 불을 완전히 줄이고 커팅 해주세요~%커팅을 완료 하셨으면 불을 강하게 두고 주걱으로 잘 저어 가면서 양념을 졸여 주면 됩니다. 시잔처럼 양념이 거의다 졸여져서 수분이 안보일때까지 졸여 주시면 됩니다~%완성입니다~ 윤기가 파르르 한게 정말 맛있엇어요~ 밥반찬으로도 술안주로도 강추 입니다~ 페이지속 레시피 동영상 시청은 레시피 제작에 커다란 힘이 됩니다.,건강/안전추구형%합리추구형
완전맛있는 차돌박이찜! 미소된장마요소스도 함께~,2인분,15분 이내,아무나,6881099,메인반찬,찜,손님접대,차돌박이%소고기%10장&깻잎%채소류%5장&팽이버섯%버섯류%1묶음&숙주나물%채소류%1주먹&미소된장%기타%1큰숟갈&마요네즈%기타%1숟갈&올리고당%기타%1숟갈&다진마늘%기타%0.5숟갈&고춧가루%기타%0.3숟갈&청양고추%기타%1개다진것&물%기타%2숟갈&,팽이버섯은 밑둥을 잘라내고 씻어주시고 깻잎도 흐르는물에 씻어주세요%차돌박이 위에깻잎을 올리고%그위에 팽이버섯을 올려준뒤%돌돌 말아주기만하면 완성이에요%만드는 방법 완전 간단하죠?%냄비에 숙주나물을 한주먹 깔고%차돌박이를 올려 10분간 쪄주면 끝%차돌박이찜이 완성되는 사이 소스를 만들어볼게요! 처음엔 된장이랑 마요네즈? 하실텐데 드셔보시면 고기랑 정말 잘어울리는 소스!%분량의 재료들을 잘섞어주시면되구요 미소된장이 없으시다면 집된장 말고 시판된장 싱거운걸 사용하셔도 됩니다%차돌박이 찜기에 넣고 소스만들면 그사이 차돌박이찜 완성입니다 금새 익기때문에 정말 초스피드로 완성할수있는 요리에요%예쁘게 그릇에 담아주면 끝!%된장마요소스에 콕 찍어먹으면 정말 맛있답니다 강력추천!,간편추구형%건강/안전추구형%모험추구형%합리추구형
새우요리 갈릭마요새우~ 요거 완전 맛있지~,1인분,15분 이내,아무나,6872474,메인반찬,볶음,일상,냉동새우%수산물류%1줌&마요네즈%기타%4큰술&다진마늘%기타%1큰술&설탕%기타%1큰술&후추%기타%약간&소금%기타%약간&,냉동 새우 한줌을 해동 시켜주세요. 그냥 실온에 두셔서 해동시키셔도 되고 전자렌지 해동기능을 사용하셔도 되요. 전 좀 느지막히 꺼내놓아서 전자렌지에 해동했어요.%전자렌지에 냉동새우를 잠깐 돌리는 동안 분량의 양념을 섞어서 만들어주세요. 마요네즈 4큰술 다진마늘 1큰술 설탕 1큰술%해동이 끝난 냉동새우는 후추와 소금을 뿌려서 잠깐 재워두었어요.%20분 정도 지나고 물기를 어느정도 제거해주고 기름을 두른 팬에 밑간한 새우를 넣고 앞뒤로 살짝 뒤집어 가며 익혀주세요~%어느정도 노릇노릇해지면 섞어놓은 양념을 넣고 같이 섞어주시면 되요%양념이 어느정도 노릇해 지면 불꺼서 마무리~!! 완성된 갈릭마요새우예요~~!!,간편추구형%합리추구형
해물찜처럼 맛있는 백종원 소시지콩나물찜,3인분,30분 이내,아무나,6899265,메인반찬,찜,일상,콩나물%채소류%1봉&비엔나소시지%가공식품류%1봉&대파%채소류%1대&양파%채소류%1/2개&고추장%기타%2T&고추가루%기타%2T&간장%기타%4T&설탕%기타%1T&간마늘%기타%1T&참기름%기타%1T&,먼저 콩나물 1봉지를 깨끗이 씻어 체에 받쳐 둡니다.%양파는 얇게 채썰어 주시구 대파와 비엔나소시지는 어슷썰기를 해 줍니다.%팬에 식용유 약간 두르고 소시지를 달달달 볶다가 절반정도 익으면 종이컵기준 물1컵을 붓고 끓여 주세요%물이 끓으면 대파 양파 콩나물을 넣구 참기름을 제외한 양념을 다 넣고 섞어줍니다%뚜껑을 닫고 팔팔 끓여 주세요.%콩나물 숨이 죽고 국물이 자작해지면 전분1T에 물2T를 섞어 전분물을 만들어 조금씩 부어줍니다%국물이 걸죽해지면 참기름1스푼넣고 섞어주심 끝!%해물찜처럼 칼칼하고 맛있는 밥도둑 백주부님 '소시지콩나물찜'이 완성되었어요.콩나물과 소시지를 함께 한입 먹어보니 아삭아삭한 콩나물에 소시지가 어우려져 참 맛있어요. 뜨끈한 밥에 김가루 약간 넣고 비벼 먹어두 넘 맛있어요,건강/안전추구형%합리추구형
단짠단짠의 대패덮밥,2인분,30분 이내,초급,6878340,밥/죽/떡,볶음,초스피드,대패 삼겹살%돼지고기%400g&대파%기타%2뿌리&설탕%기타%2스푼&맛간장(OR진간장)%기타%4스푼&,궁중팬에 대패삼겹살을 넣어줍니다.%대파는 큼직하게 썰어서 준비합니다.%대패삼겹살이 골고루 익도록 볶아줍니다.%고기가 적당히 익으면 준비한 대파를 넣고 좀더 볶아줍니다.%대패삼겹살이 노릇해질 정도로 충분히 익혀준 뒤%설탕 2스푼을 넣고 한번 더 볶아줍니다.%설탕을 넣고 볶아주면 고기에 윤기가 돌아요.%맛간장 또는 진간장을 4큰술 넣고 한번 더 볶아줍니다.%삼겹살에 간장 양념이 골고루 베이도록 볶아주면 완성이에요^^%오목한 그릇에 따뜻한밥을 담고 그 위에 볶은 고기를 올려주면 대패덥밥 완성!,합리추구형
치킨너겟으로 간편하게 간장치킨 만들기,2인분,15분 이내,아무나,6868389,메인반찬,조림,초스피드,치킨너겟%가공식품류%20개&견과류(아몬드or땅콩)%콩/견과류%1줌(생략 가능)&진간장%기타%3스푼(밥수저)&설탕%기타%2스푼(밥수저)&올리고당%기타%3스푼(밥수저)&다진 마늘%기타%1스푼(밥수저)&매실액%기타%1스푼(밥수저)&맛술%기타%2스푼(밥수저)&물%기타%3스푼(밥수저)&,[치킨너겟 노릇하게 튀기기] 프라이팬에 치킨너겟이 절반 정도 잠길정도의 식용유를 두르고 로 한 면씩 뒤집어 가며 튀겨주세요. 제 기준으로 5분씩 총 10분 튀겨주었어요.%튀겨진 너겟은 키친타월에 올려서 표면 기름을 제거해주세요.%[간장치킨 소스 만들기] 작은 볼에 진간장 3 스푼 설탕 2스푼 올리고당 3 스푼 다진 마늘 1 스푼 매실액 1 스푼 맛술 2 스푼 물 3스푼을 넣고 섞어주세요.%[간장소스에 버무리기] 움푹 팬 프라이팬에 소스를 넣고 로 가열해 주세요. 몇 초 후 끓기 시작하면 로 내린 후 치킨너겟을 모두 넣고 주걱으로 버무려 주세요.%너겟은 소스를 순식간에 흡수시키니 빠르게 버무려 주세요%[취향에 따라 견과류 추가] 소스가 거의 없어졌을 때 먹기 좋게 부셔놓은 견과류를 넣어주시고 에서 30초 정도만 버무려 주세요.%견과류를 넣으시면 고소하고 오독한 식감이 추가되니 추천 드려요.,간편추구형%합리추구형
우리집 최애 반찬 마늘아몬드조림 레시피,3인분,20분 이내,아무나,6933349,메인반찬,볶음,영양식,통마늘%채소류%40알&아몬드%콩/견과류%1줌&통깨%기타%솔솔&식용유%기타%약간&간장%기타%2T&물%기타%2T&물엿%기타%1.5T&,먼저 깐 마늘은 물로 한번 헹구어 주시구요. 마늘이 너무 크다면 먹기좋게 반쪽으로 나눠 주세요%달궈진 팬에 식용유를 둘러 준 뒤 마늘을 넣고 튀기듯 노릇노릇 구워 줍니다. 굽다보면 마늘의 알싸한 향이 올라와 군침돌아요%마늘이 노릇노릇 구워지면 아몬드도 넣고 살짝 볶아줍니다%다 볶아지면 미리 준비해둔 양념을 부어 약불에서 타지 않게 조려주심 끝^^%정말 간단하게 만든 건강반찬 마늘아몬드 조림 완성이에요%물엿이 들어가서인지 윤기가 좌르르 흘러요.한번 먹어보니 알싸한 맛이 하나도 없고 정말 부드러우면서 맛있네요 간장과 물엿의 양념들이 어우러져 단짠단짠한 맛이 밥과 함께 먹으면 참 맛있어요 몸에 좋은 마늘과 아몬드의 조합이라 우리집 최애반찬으로 추천합니다^^암환자분들 항암반찬으로도 좋습니다.,모험추구형
담백한 새우연두부달걀탕,2인분,15분 이내,아무나,6847470,국/탕,끓이기,초스피드,연두부%콩/견과류%1팩&새우%수산물류%10-12마리&달걀%달걀/유제품%1개&송송 썬 쪽파%기타%1-2줌&다시마 5cm x 5cm%기타%1장&간장%기타%1-1.5T&,우선 다시마물을 만들어요. 냄비에 물 붓고 다시마를 넣어 센 불에서 끓이다 끓어오르면 약불로 줄여 약 15분간 더 끓여주세요.%15분 후 다시마는 건져 내고%수저로 듬성듬성 연두부를 퍼서 냄비에 넣어주세요.%그리고 새우 넣고 간장 1-1.5T 넣어주세요.%센 불에서 약 5분간 팔팔 끓여주세요. 떠오르는 거품은 걷어주세요~%불을 약불로 줄이고 달걀물을 원을 그려가며 쪼로록 부어주세요. 달걀물이 바닥에 붙지 않도록 한번만 휘이 저어주세요.%쪽파 올리고 후추 톡톡하면 완성입니다. 간 보고 싱거우면 소금으로 간해주세요~,간편추구형%건강/안전추구형%모험추구형
칠리새우ㅣ쉬림프 박스 만들기,2인분,30분 이내,아무나,6881815,메인반찬,볶음,도시락,칵테일 새우%수산물류%1컵(종이컵)&다진마늘%기타%1스푼&버터%기타%1조각&식용유%기타%2스푼&케찹%기타%2스푼&고추가루%기타%1스푼&설탕%기타%1스푼&간장%기타%1스푼&식초%기타%1스푼&물%기타%약간&,냉동새우는 물에 넣고 해동시켜주세요%칠리 소스 재료들을 모두 넣고 섞어주세요%팬에 식용유를 두르고 다진 마늘을 낮은 불에서 살짝 볶아주세요%마늘이 살짝 익을 때쯤 해동된 새우를 넣고 후추로 살짝 뿌려주세요%새우가 익어가면 소스를 넣고 소스와 새우가 함께 잘 버무려지게끔 물을 살짝 넣고 섞어주세요%마무리로 버터를 한조각 넣고 섞어주세요%밥을 준비해주세요%밥 위에 칠리새우를 올려주시면 완성입니다 !,합리추구형
비엔나 만두 강정,2인분,15분 이내,아무나,6877253,면/만두,볶음,초스피드,비엔나소세지 작은거%가공식품%1봉&물%기타%1T&간장%기타%1T&고추장%기타%2T&케찹%기타%2T&올리고당%기타%1.5T&다진마늘%기타%1t&참기름%기타%약간&깨%기타%약간&,만두는 기름을 두룬 팬에 노릇하게 구워줍니다.%비엔나 소세지에 원하는 모양대로 칼집을 내고 팬에 볶아줍니다. 양파가 있다면 같이 볶아줘도 좋아요:)%비엔나가 어느정도 구워지면 만두를 같이 넣어줍니다.%양념장을 넣고 양념이 고루 베이도록 잘 섞어줍니다.%양념이 어느정도 베이면 위에 통깨를 뿌려 마무리합니다.%간식이나 술안주 밑반찬으로 먹기 좋은 비엔나만두강정 완성!,간편추구형%모험추구형%합리추구형
초간단 럭셔리요리@ 매콤참치퀘사디아,2인분,5분 이내,아무나,6846168,빵,굽기,초스피드,또띠아%제과/제빵%2장&참치캔%가공식품%1개&치즈%달걀/유제품%취향껏&양파%채소류%0.5개&청양고추%기타%1개&토마토소스%기타%4T&,참치캔 햄 양파 치즈(취향대로) 토마토소스 또띠아를 준비하고 추가로 느끼함을 잡아주고 매콤함을 더해주기위해 청양고추도 준비합니다.%또띠아 한쪽면에 토마토소스를 2T덜어 바르고 캔참치의 기름기를 최소화하여 올려줍니다%그 위로 양파올리고%햄올리고%청양고추는 잘게썰어 고루 분포시켜 올리고 본인이 좋아하는 재료 더 추가합니다.%다른 또띠아의 한면에도 토마토소스를 2T 발라줍니다%기존에 재료쌓아올린 또띠아에 치즈를 듬뿍올리고%덮어줍니다 그리고 이대로 전자렌지에서 2분 돌려주면%끝%치즈가 녹아있죠%먹기좋게 잘라주고%하나씩%집어들어%먹으면 기가 막히는 맛입니다♥,간편추구형%모험추구형
밥도둑 반찬 고추장 달걀조림 만들기!TV 알토란 레시피,3인분,20분 이내,아무나,6915088,메인반찬,조림,영양식,달걀%달걀/유제품%10개&양파%채소류%1개&청양고추%기타%3개&쪽파 또는 대파%채소류%약간&멸치육수%기타%1.5컵&고추장%기타%2T&고춧가루%기타%3T&진간장%기타%4T&설탕%기타%2T&물엿%기타%3T&참기름%기타%2T&깨%기타%1T&후추%기타%1ts&,먼저 물에 소금1T 식초1T를 섞어 달걀을 7-8분 반숙으로 삶아 줍니다.%달걀이 삶아지는 동안 양파는 굵게 채 썰고 청양고추도 큼직큼직 썰어주셔요%달걀이 삶아지면 얼음물에 바로 행궈 껍질을 깔끔히 잘 벗겨 줍니다.%참기름과 깨를 제외한 모든 양념을 한곳에 미리 섞어주셔요.%냄비에 멸치육수를 넣고 양념을 잘 풀어 주신뒤 끓여줍니다.%양념이 끓기 시작하면 양파와 청양고추를 넣고 끓여줍니다.%양념이 반정도 졸아들었다 싶을때 반숙달걀을 투하 해줍니다.이대로 약 2분정도 더 끓여주시면서 달걀에 색이 입혀지게 국물을 끼얹어 주세요%마지막으로 참기름 2T와 깨1T를 넣고 잘섞어주시고 쪽파를 고명으로 올려주시면 끝!%밥도둑 반찬 알토란 임성근님의 고추장 달걀조림 완성입니다^^%한번 먹어보니 촉촉한 반숙달걀에 매콤달콤 양념이 어우려져 넘 맛있네요.꼭 떡볶이 양념같은게 은근 중독성 있고 정말 짱짱짱!뜨끈한 밥에 비벼 먹으면 밥 한공기 뚝딱 하게 됩니다^^,건강/안전추구형%모험추구형
두부강정 맵지않은 소스로 아이들 입맛까지 확 ~,2인분,30분 이내,아무나,6892138,밑반찬,부침,일상,두부%콩/견과류%1모&부침가루%기타%약간&식용유%기타%약간&케첩%기타%3큰술&올리고당%기타%2큰술&설탕%기타%1큰술&간장%기타%2큰술&다진마늘%기타%1큰술&,재료도 간단하고 만드는법도 간단한 아이들 입맛사로잡는 두부요리 ! 두부강정 만드는법 알려드릴께요 :)%두부는 부침가루에 골고루 묻혀줄껀데요 그 전에 두부에 있는 물기를 어느정도 제거해줘야 해요 키친타월이나 주방용 면보를 사용하셔서 두부에 묻어있는 물기를 제거해주세요%물기를 어느정도 제거해준뒤에는 먹기 좋은 크기로 잘라주세요 너무 작게 잘라서도 해봤는데 튀겨줄때 조금 귀찮더라고요 ㅎㅎ 그래서 저는 깍두기보다 조금 더 큰 크기로 잘라줬어요%그 다음은 두부에 부침가루를 골고루 묻혀줄 차례인데요 손으로 하나하나 묻혀주는것도 좋지만 제일 간단한 방법으로는 요렇게 위생봉투를 사용하는 것이지요 ! 위생봉투안에 부침가루를 적당량 넣어주고 썰어둔 두부를 몽땅 넣어 흔들흔들 흔들어주세요 ~ 그럼 손에 묻히지 않고도 두부에 부침가루를 골고루 입힐수 있어요%부침가루 곱게 입은 두부들을 이제 튀겨줄꺼예요 프라이팬에 식용유를 적당히 둘러주세요 튀길때는 기름이 조금 많이 들어가니 넉넉하게 둘러주시면 좋겠지요 그리고 중간불 정도의 세기에 맞춰두고 두부를 올려주세요 부침가루가 너무 많이 묻어있는 두부는 한번씩 탈탈 털어서 올려주세요 ~%두부가 노릇하게 익는동안 약간의 시간이 걸리는데요 이때 두.부.강.정 소스를 만들어 주면되요 케첩 3큰술 간장 2큰술 설탕 1큰술 다진마늘 1큰술 올리고당 2큰술 분량대로 넣어서 골고루 섞어서 준비해주세요 조금 매콤한걸 원하시면 고추장을 1큰술 정도 넣어주셔도 좋을듯해요%두부는 요리조리 돌려줘가며 골고루 노릇노릇하게 익혀주세요 ~%하게 익혀준 두부들은 키친타월에 올려 기름기를 살짝 제거해주시고요%아까 만들어뒀던 분량의 소스를 한번 끓여줄꺼예요 너무 팍 끓이면 안되고 은근한불에 살짝만 데운다는 느낌으로 끓여주세요%소스가 파르르 끓어오르기 시작하면 불을 꺼주시고요 잘 튀겨준 두부들을 넣어서 골고루 섞어주세요%골고루 섞어주기만 하면 맛있는 두부강정 완성이예요 ! 평소 저희 아이들은 두부를 그리 좋아하진 않아요 근데 요거 해주면 잘 안먹던 두부도 너무 잘먹는답니다 새콤달콤한 소스가 아이들 입맛 사로잡는데 한몫더했겠죠 ㅎ,건강/안전추구형%합리추구형
봄동 된장무침,6인분 이상,15분 이내,아무나,6866122,밑반찬,무침,일상,데쳐서 물기짠 봄동%채소류%600그람&다진 파%기타%2큰술&다진마늘%기타%1큰술&된장%기타%2큰술&고추장%기타%1큰술&매실액%기타%2큰술&참기름%기타%1큰술&통깨%기타%1큰술&소금%기타%약간&,봄동은 잎이 연한것으로 고른다.%잎을 떼어 끓는 물에 소금을 넣고 데친다.%찬물에 여러번 헹구어 씻어 물기를 꼭 짠다.%파와 마늘은 다진다.%봄동은 먹기좋은 크기로 자른다.%위의 양념으로 조물조물 무친다.%접시에 담는다.,간편추구형%건강/안전추구형%합리추구형
꿀마늘 닭강정(아이들 단골메뉴 찜♡♡),4인분,30분 이내,초급,6897374,메인반찬,조림,영양식,닭봉%닭고기%1팩(500그램)&파프리카%채소류%조금&간장%기타%2숟가락&설탕%기타%2숟가락&꿀%기타%3숟가락&마늘%채소류%15개&후추가루%기타%조금&,닭봉에 소금 1작은술 넣어 조물조물한 후에 20분정도 둬요%끓는물에 데쳐요%팬에 간장 설탕 마늘넣고 내용물 반정도 잠기게 물을 넣어요%뚜껑닫고 국물 반정도 될때까지 중불정도에서 끓여요%뚜껑연채로 꿀3숟가락.후추가루넣어요%국물이 없어지고 갈색될때까지 졸여요%파프리카넣어서 버물버물 마무리해요~ 저는 기본적으로 통깨 팍팍을 더 좋아해요~,건강/안전추구형%합리추구형
애호박 덮밥 혼밥으로 딱 좋아~,2인분,15분 이내,아무나,6881286,밥/죽/떡,볶음,일상,애호박%채소류%1개&양파%채소류%1/2개&굴소스%기타%1큰술&고춧가루%기타%1큰술&다진마늘%기타%1t&참기름%기타%&식용유%기타%&달걀%달걀/유제품%&,덮밥으로 애호박을 볶을 때는 조금 큼직하게 채를 썰어 준다 식감도 더 좋고 흐물거리지 않아 좋다%큼직하게 채 썰은 호박과 양파를 준비%팬에 참기름 1 큰 술과 식용유를 살짝 넣어 야채 볶기%애호박과 양파를 볶아 준다%애호박이 반쯤 익었을 때쯤에 준비한 양념을 넣어 야채와 골고루 섞어 준다%굴소스 고춧가루 다진마늘을 섞어 양념을 만든 뒤 넣어 준다%애호박에 간이 잘 베이고 익히려고 뚜껑을 닫고 약한 불에 조리했다 뚜껑을 닫지 않아도 되지만 그럼 수분이 빠져나가서 자꾸 뒤적거리게 되고 그럼 호박이 으깨지기도 하니까~%마지막에 대파를 넣고 참기름도 넣어 한 번 더 휘리릭 볶아서 수분을 날리면 끝 사실 너무 간단한 음식이라는 거^^%달걀 프라이와 같이 올려내니 먹음직스럽다 애호박 한 개와 양파만 있으면 10분 안에 만들어지는 간단 메뉴 달걀 프라이까지 올려내니 정말 성의 있어 보이는 한 끼가 되었다,간편추구형%모험추구형%합리추구형
매콤버섯덮밥~한그릇,1인분,30분 이내,아무나,6869489,밥/죽/떡,볶음,일상,느타리버섯%버섯류%80그램&양파%채소류%60그램&대파%채소류%1대&밥%쌀%1공기&참깨%기타%약간&간장%기타%1+1/2숟가락&물%기타%3숟가락&고추가루%기타%2숟가락&참기름%기타%1/2숟가락&설탕%기타%2/3숟가락&,느타리버섯은 길게 찢어주시고 양파는 채썰어주세요 느타리버섯대신 새송이버섯이나 다른버섯을 사용하셔도 좋아요%양념장재료를 섞어 양념장을 만들어주세요%달군팬에 대파를 넣어주세요%양파를 넣고 센불로 20초정도 볶아주세요%버섯을 넣어 1분간 더 볶아주시다가 중간불로 줄여 양념장을 넣어 볶아주세요 더 맵게 드시고 싶은 분들은 여기에 청양고추를 더 넣어주시며 되세요%양념장재료가 스며들도록 30초정도 볶아주신후에 그릇에 밥을 담고 밥위에 올려주신후에 참깨를 솔솔 뿌려 주세요,합리추구형
봄동된장무침,4인분,30분 이내,아무나,6928051,밑반찬,무침,일상,봄동%채소류%300g&대파%채소류%적당량&된장%기타%1큰술&고추장%기타%1/2큰술&들기름%기타%2큰술&다진마늘%기타%1/2큰술&통깨%기타%&,굵은소금 반큰술넣고 살짝 데쳐준다%찬물에 충분히 헹궈 물기를 꼭 짜준다%먹기좋게 썰어 볼에 담고%대파 다져넣고 분량의 양념을 모두 넣은 뒤%조물 조물 무쳐 그릇에 담아낸다,건강/안전추구형%합리추구형
달콤 짭조름♡ 떡 베이컨 간장조림♡,3인분,5분 이내,아무나,6843136,밑반찬,조림,초스피드,베이컨%가공식품류%&대파%채소류%&떡%쌀%&간장%기타%&참기름%기타%&물엿%기타%&기름%기타%&,대파에 떡국떡 (가래떡 떡볶이떡) 베이컨%기름두르고 볶듯구워요.(튀기듯하면 더 맛있습니다)%간장.물엿.참기름을 넣어 볶아요. 간장 한스푼 물엿 넉넉히 참기름한스푼(이런 느낌 비율로. )%볶아주며 졸입니다.%국물없게끔 졸여야 맛있어용: )%깨도 뿌리고 한번 볶아준 후 끝.%완성^^,간편추구형%합리추구형
매운 팽이버섯 조림 간단 반찬/술안주/맥주안주/소주안주 굿굿!!,1인분,5분 이내,아무나,6927971,메인반찬,조림,술안주,팽이버섯%버섯류%1봉지&고추장%기타%1스푼&진간장%기타%1스푼&설탕%기타%1스푼반&다진마늘%기타%1스푼&물%기타%2스푼&,팽이버섯 밑둥을 자르고 한입 크기 덩어리로 분리해줍니다%팬에 기름을 두르고 팽이버섯을 앞뒤로 30초씩 구워 줍니다%분량의 소스를 팽이버섯 위에 부어 줍니다%앞뒤로 30초씩 조려 주면 완성!,간편추구형%건강/안전추구형%합리추구형
