한숟갈 뜰 때마다 영양 듬뿍! 소고기표고버섯덮밥♥,2인분,30분 이내,아무나,6858529,밥/죽/떡,볶음,일상,채 썬 표고버섯%버섯류%4개&채 썬 양파%기타%1/2개&채 썬 당근%기타%1/5개&소고기%소고기%100g&전분%기타%1T&물%기타%50ml&간장%기타%1T&다진마늘%기타%1/2T&맛술%기타%1T&물%기타%300ml&간장%기타%2T&굴소스%기타%1T&설탕%기타%1/2T&참기름%기타%1T&후추%기타%약간&,"볼에 고기를 넣고 간장 1T 다진마늘 1/2T 맛술 1T 넣어 고기 밑간을 한다.%<p class=""step_add add_material"">소고기 100g</p>%<p class=""step_add add_tool"">볼</p>%팬에 밑간 한 고기를 볶다가 채 썬 양파 채 썬 당근을 넣고 볶는다.%<p class=""step_add add_material"">채 썬 양파1/2개 채 썬 당근 1/5개</p>%<p class=""step_add add_tool"">팬</p>%양파가 투명해 지면 표고버섯을 넣어 볶는다.%<p class=""step_add add_material"">채 썬 표고버섯 4개</p>%버섯이 숨이 죽으면 간장 2T 굴소스 1T 설탕 1/2T 를 넣어 간을 한다.%재료가 볶아지면 물 300ml를 넣어 한소끔 끓인다..%볼에 전분 1T 물 50ml를 넣고 전분 물을 만들어 넣어 뭉치지 않게 바로 섞는다.%마지막으로 불을 끈 후 후추 약간 과 참기름 1T를 넣어 완성한다.",
포송 쫀득! 치즈 공구마 만들기ㅣ전자렌지 3분 컷 고구마 요리,1인분,10분 이내,초급,6902285,디저트,기타,간식,밤고구마%채소류%2개&체다치즈%달걀/유제품%4장&버터%기타%1T&소금%기타%1꼬집&설탕%기타%1T&,껍질벗긴 고구마는 양끝을 자르고 잘게 잘라줍니다.%자른 고구마는 그릇에 담고 물을 소량 넣어줍니다.%접시는 덮고 전자레인지에 4~6분 돌려줍니다.%물을 3숟가락 정도만 남긴 후 버려주세요.%포크도 잘 으깨주세요 %고구마가 뜨거울 때 체다치즈 버터 소금 설탕을 넣고 잘 섞어줍니다.%찰기가 생기면 동글동글하게 만들어줍니다.%만들어 준 고구마 볼을 전자레인지에 3분간 돌려주세요.%접시에 옮긴 후 한김 식혀 완성해주세요.,간편추구형%모험추구형
참치쌈장 - 간단 반찬,2인분,15분 이내,아무나,6884950,김치/젓갈/장류,조림,일상,참치 캔%가공식품류%1개(200g)&대파%채소류%1대&양파%채소류%1/2개&청양고추%기타%2~3개&된장%기타%2큰술&고추장%기타%2큰술&고춧가루%기타%1큰술&다진 마늘%기타%1큰술&설탕%기타%0.5큰술&물%기타%1/2컵&참기름%기타%약간&,"밥도둑 반찬 고소하고 짭조름한 참치 쌈장 만들기 ♬♪%· 대파 잘게 다져주고%· 양파도 1/2개 다져줍니다%· 청양고추는 기호에 맞게 2~3개 다져주세용%<p class=""step_add add_tip2"">참고로 저는 3개 다져서 넣었는데도<br> 많이 안 맵더라구요 ㅎㅎ</p>%· 냄비나 뚝배기에 참치캔에 참치 기름을 꾹꾹 눌러 빼 줍니다%· 참치 기름에 대파를 볶아주다가%· 대파향이 올라올 때쯤 다진 양파를 넣어주고%· 참치 쌈장의 양념을 넣어 줍니다 ※ 참치쌈장 양념 【 된장 2 큰 술 고추장 2 큰 술 고춧가루 1 큰 술 다진 마늘 1 큰 술 설탕 0.5 큰 술 】 -밥숟가락 계량%<p class=""step_add add_tip2"">( 입맛에 따라 원하는 양념을 가감해주세요 :D)</p>%· 중약불에서 양념을 골고루 섞어준 뒤%· 물 1/2컵(종이컵 기준)을 넣어 줍니다%· 기름기를 뺀 참치캔과%· 다진 청양고추를 넣고 밑이 타지 않게 계속 저어주며 살짝만 더 끓여주다가%· 가장자리부터 서서히 끓기 시작하면 불을 끄고 참기름 1바퀴 쓱 둘러주면 완성!!%불을 끄고 참기름 1바퀴 쓱 둘러주면 완성!!%참치가 들어가 고소하고 짭짤한 쌈 싸 먹기 좋고 밥에 비벼 먹어도 맛있는 참치 쌈장",간편추구형%건강/안전추구형
1분완성 핵꿀맛 간식 토스트!완전 강추드려요!,1인분,5분 이내,아무나,6895448,빵,굽기,초스피드,식빵%제과/제빵%1장&슬라이스치즈%달걀/유제품%1장&캔옥수수%곡류%2T&버터%기타%1/2T&설탕%기타%적당히&,"먼저 녹인 버터를 식빵에 골고루 발라줍니다.%<p class=""step_add add_tip2"">버터는 전자렌지에 10초 정도 돌려 녹여주심 되요</p>%슬라이스 치즈 한장 올려 주고 그 위에 캔옥수수 2스푼 올려 줍니다.%설탕은 기호에 맞게 솔솔 뿌려주세요. 파슬리가루는 선택사항이지만 뿌리면 좀 더 맛있어 보이지요%이제 700W기준 전자렌지에 넣고 40초만 돌려주심 끝!%1분완성 핵꿀맛 토스트 완성입니다! 한입 먹어보니 고소한 버터에 고소한 치즈 톡톡 터지는 옥수수가 어우려져 진짜 맛있어요!",간편추구형%합리추구형
달콤 바삭 캬라멜 식빵팝콘 만들기,2인분,30분 이내,아무나,6895214,과자,굽기,간식,식빵%제과/제빵%7쪽&버터%기타%1큰술&설탕%기타%1/2종이컵&물%기타%1소주컵&우유%기타%1종이컵&,재료를 준비해주세요~.%식빵을 가로 1cm × 세로1cm 크기로 잘라서 준비해주세요~.%마른팬에 자른 식빵을 넣고 중불에서 10분정도 구워주세요~.%식빵겉면이 딱딱해진느낌이면 된거에용~~~!!! 식빵에 색이 안나게 하는게 모양이 예뻐서 중불에 오래도록 구워주는것이랍니다~.%잘구워진식빵을 체에받쳐서 빵가루를털어내주세요~.%팬에 설탕과 물을 넣고 센불에서 절대로 젓지말고 녹여주세요~.%설탕이 모두 녹았으면 중불로 낮춰준뒤에 버터를 넣고 녹여주세요~.%버터가 다 녹았다면 우유를 넣어주세요~.%중불에서 늘러붙지않게 계속 휘저어가면서 캬라멜색이날때까지끓여주세요~.%캬라멜색이나면 불을 약불로 줄여주세요~.%아까 구워두었던식빵을 캬라멜소스에 넣고 약불에서 30초정도 재빠르게 볶아주세요~.%캬라멜소스를 식빵에 골고루 뭍혀주세요~.%쟁반에 호일이나 종이를 깔아주세요~.%식빵팝콘을 쟁반에 부은 후 식혀서 드시면 완성이랍니다~~~!!!♡♡♡,모험추구형
[간단 자취요리] 콘꼬노미야끼 만들기,1인분,15분 이내,아무나,6872282,디저트,굽기,초스피드,참치%가공식품류%1캔(작은것 100g)&스위트콘%곡류%200g&양파%채소류%1/2개(작은것)&,"먼저 양파를 작은 큐브모양으로 썰어줍니다.%계란에 소금을 넣고 풀어주세요!%양파 참치 콘을 넣어주세요.%살짝 섞은 뒤 부침가루도 추가!%기름을 두르고 중불에서 구워줍니다! 처음에는 꾹꾹 눌러서 모양을 잡아주세요!%<p class=""step_add add_fire"">중불</p>%마요네즈를 뿌려주면 완성!",간편추구형%모험추구형
[초간단 노오븐 베이킹] 5분완성 브라우니 만들기,1인분,5분 이내,아무나,6868357,빵,굽기,초스피드,계란%달걀/유제품류%1알&설탕%기타%큰1스푼&데코용 딸기(필수아님)%과일류%1개&,"계란을 한 알 그릇에 넣고 알끈을 제거한 뒤 티스푼이나 젓가락으로 휘저어주세요%설탕을 큰 한스푼 넣고 설탕이 다 녹을때까지 풀어주세요%핫초코 가루를 큰 세스푼 듬뿍 넣어준 뒤 잘 섞이도록 꼼꼼하게 저어주세요%<p class=""step_add add_tip2"">스틱에 들어있는 핫초코라면 <br> 한봉지만 뜯어 넣어주면 됩니다!</p>%전자렌지에 20-30초만 돌려주면 완성!!! 진짜 쉽죠^ㅠ^%<p class=""step_add add_tip2"">슈가롱은 양을 적게해서 20-30초로 끝났지만 <br> 양을 좀 더 많이 하는 분들은 그만큼 더 많은 시간 돌려줘야 맛있게 잘 익으니 참고하세요!</p>",간편추구형%합리추구형
집에서도 쉽게 만드는 방구석 푸팟퐁커리 만들기(aka. 계란카레 레시피),2인분,30분 이내,초급,6928699,메인반찬,볶음,일상,카레가루%기타%3큰술&크래미%가공식품류%90g&계란%달걀/유제품%2개&우유%달걀/유제품%400ml&대파%채소류%1/4개&양파%채소류%1/2개&페페론치노%기타%6개&튀김가루%기타%&물%기타%&고춧가루%기타%1큰술&다진마늘%기타%1큰술&간장%기타%1큰술&올리고당%기타%1큰술&식초%기타%1큰술&,양파와 대파는 송송 썰고 페페론치노는 잘게 으깨주세요.%크래미 맛살은 먹기 좋은 크기로 썰어줍니다.%튀김가루와 물을 넣고 튀김반죽을 만들어 준 뒤 맛살을 넣어줍니다.%프라이팬에 식용유를 두르고 맛살을 노릇하게 튀겨주세요.%그 다음 팬에 대파를 넣고 파기름을 내준 뒤 고춧가루 1큰술 다진마늘 1큰술 페페론치노를 넣고 같이 볶아주세요.%재료들이 잘 섞이면 여기에 양파를 넣고 살짝 볶아주세요.%양파가 반투명하게 익으면 여기에 간장 1큰술 올리고당 1큰술 식초 1큰술을 넣고 다시 한번 더 볶아주세요.%다음 카레가루 3큰술을 넣어주세요. (카레가루는 듬뿍)%살짝 한번 볶아준 뒤 우유 400ml를 부어주세요.%카레가 걸쭉하게 끓어오르면 계란 2개를 넣고 잘 섞어주세요.%계란이 다 익으면 여기에 맛살튀김을 넣고 살짝 한번 끓여주면 완성입니다.,모험추구형
초간단 밥도둑! 달걀장조림을 뒤 이을 간장두부장 ♥,2인분,20분 이내,아무나,6928213,밑반찬,끓이기,일상,두부%콩/견과류%1모&간장%기타%1종이컵&올리고당%기타%1/2종이컵&매실액%기타%1/2종이컵&물%기타%1/2종이컵&다진 마늘%기타%1숟가락&후추%기타%약간&통깨%기타%1/2숟가락&양파%기타%1/4개&청양고추%기타%1개&홍고추%기타%1개&,"양파는 다지고 청양고추와 홍고추는 반으로 가른 후 송송 썬다.%볼에 양념 재료를 넣고 양념장을 만든다. %<p class=""step_add add_store""> <a href=""https://shop.10000recipe.com/goods/goods_view.php?goodsNo=1000007105&amp;utm_source=10k_recipe&amp;utm_medium=recipe_view_join_step&amp;utm_campaign=옻칠 우드 조리도구 수저세트 "" onclick=""doGoodsClickLog(53742885 'recipe_view_join_step')"" target=""_blank""> 옻칠 우드 조리도구 수저세트 </a> </p>%끓는 물에 두부를 3분간 데친다.%데친 두부는 한 입 크기로 썰고 키친타월로 물기를 제거한다.%밀폐용기에 데친 두부를 넣고 양념장을 부어 완성한다.%<p class=""step_add add_tip2"">반 나절 냉장고에서 숙성 후 드세요. </p>",건강/안전추구형
시금치(포항초)알리오올리오:시금치를 좋아하게 만드는 파스타,1인분,15분 이내,아무나,6865518,면/만두,볶음,푸드스타일링,스파게티면%면%100~150그램&마늘%채소류%6~7톨&다진마늘%기타%1/2큰술&시금치(포항초)%채소류%4~5뿌리&굴소스%기타%1작은술+&올리브오일%기타%2큰술+&소금%기타%&후추%기타%&굵은소금%기타%&,"끓는물에 스파게티면과 굵은소금을 넣고 7분정도 삶는다 (패키지에 쓰인 삶는 시간에서 1~2분 덜 삶기)%스파게티가 거의 삶아질 무렵 팬에 올리브오일을 두르고 편마늘과 다진마늘을 넣어 볶는다:%<p class=""step_add add_tip2"">비주얼상으로는 편마늘이 더 좋으나 마늘맛을 진하게 내는데는 다진마늘이 좋으므로 둘을 같이 넣어주면 좋아요<br> </p>%마늘이 노릇노릇 익으면 시금치와 굴소스를 넣고 볶는다%<p class=""step_add add_tip2"">굴소스 대신 맛간장을 넣어주어도 좋고<br> 그냥 소금으로 간을 맞춰도 깔끔하고 맛있어요</p>%스파게티면을 넣어 함께 볶아준다%필요하면 면수 좀 추가하고 소금+후추 넣어 마무리한다:%접시에 파스타를 담고 올리브오일을 휘리릭 두르고 파슬리가루를 뿌려낸다",간편추구형%모험추구형
두부 강정..,3인분,30분 이내,아무나,6924603,밑반찬,굽기,일상,두부%콩/견과류%1모&식용유%기타%넉넉히&전분가루%기타%1컵&고추장%기타%1/2큰술&케첩%기타%7큰술&간장%기타%2큰술&요리당%기타%7큰술&다진마늘%기타%1티스푼&소금%기타%1꼬집&,두부 1모는 깍뚝썰어주세요~%비닐 봉지에 전분가루 1컵 넣고 썰어둔 두부 넣고 전분가루가 묻도록 흔들어줍니다.%후라이팬에 식용유 넉넉히 두르고 전분가루 묻은 두부 넣고 사방으로 노르스름하게 구워줍니다.%구운 두부는 키친타월에 올려 잠시 기름기를 빼주고요.%두부 구운 후라이팬에 분량의 양념장을 넣고 바글바글 끓여주다가..%불 끄고 구운 두부 넣고 골고루 묻혀줍니다.%마지막에 통깨 한큰술 뿌려주면 두부 강정 완성입니다.,합리추구형
미숫가루 컵케익,6인분 이상,60분 이내,중급,4007541,빵,굽기,간식,미숫가루%곡류%1컵&계란%달걀/유제품%3개&설탕%기타%8스푼&우유%달걀/유제품%50ml&녹인버터%달걀/유제품%6스푼&호두%콩/견과류%&아몬드%콩/견과류%&,계란흰자 3개 분량에 설탕8스푼을 넣고 거품기로 힘껏 저어 줍니다%머랭을 거꾸로 들어보았을 때 거품이 흐르지 않을 정도로 만들어 줍니다%우유 50ml를 조금씩 나누어 넣어가면서 거품이 죽지않도록 잘 섞어줍니다~ 그리고 녹인버터 6스푼도 나누어서 넣어 줍니다%반죽에 미숫가루 1컵을 체에 내려서 넣어주고 거품이 꺼지지 않게 잘 섞어줍니다%머핀팬에 종이머핀컵을 깔고 반죽을 넣은후 잘데 다진 호두와 아몬드를 올려줍니다%180도 오븐에서 20분가량 구워내시면 된답니다,모험추구형
겨자 한 스푼으로 느끼함 잡아주는 오이맛살마요무침~,2인분,15분 이내,아무나,6868911,밑반찬,무침,초스피드,오이%채소류%1개&맛살%가공식품류%5개&굵은소금%기타%2스푼&설탕%기타%2스푼&식초%기타%2스푼&연겨자%기타%1티스푼&마요네즈%기타%3스푼&검은깨%기타%조금&,오이는 소금 1스푼으로 벅벅 문질러 깨끗이 씻어서 3등분해주세요.다시 4등분으로 잘라서 씨를 제거 한 후 얇게 썰어주세요%얇게 썬 오이에 소금 1 설탕 2 식초 2 를 넣고 버무려둡니다%그 사이 맛살을 준비해주세요.3등분한 후 얇게 썰어주시거나 찢어서 준비합니다%재워 둔 오이를 몇번 조물조물하다가 물기를 적당히 짜주고 준비한 맛살과 담습니다%마요네즈 3스푼 넣고 버무리다가 연겨자 1티스푼 넣고 다시 버무려줍니다.좀 더 강한맛을 원하시면 양념을 더 추가해주세요%접시에 담고 검은깨 솔솔 뿌려주면 완성~,간편추구형%건강/안전추구형
버섯 들깨소스 무침,2인분,30분 이내,초급,4803252,밑반찬,무침,일상,느타리버섯%버섯류%200g&표고버섯%기타%4개&쪽파%기타%2대&들깨가루%기타%2Ts&멸치액젓%기타%1Ts&비정제 황설탕%기타%1/2ts&들기름%기타%2ts&,느타리버섯은 적당한 두께로 찢어서 준비하고 %표고버섯은 두툼하게 슬라이스해서 준비해요.%끓는 물에 소금을 약간만 넣어서 느타리버섯을 데쳐내고  표고버섯도 넣어서 살짝 데쳐내 물기를 빼주세요.%체에 밭쳐 물기를 뺀 다음  양념하기 전에 손으로 한번 더 물기를 짜주면 좋아요.%멸치액젓 1Ts  비정제 황설탕 1/2ts  들기름 2ts을 잘 섞어서 준비하고%물기를 뺀 버섯에 양념을 넣어서 고루 섞어줍니다.%액젓과 양념들이 고루 배이면 들깻가루를 넣어서 섞어주고 %송송 썬 쪽파를 넣어서 섞어주고 마무리 해주세요.,건강/안전추구형
크리스마스날 어울리는 칵테일 새우 청경채 볶음,2인분,10분 이내,아무나,6902329,메인반찬,볶음,손님접대,청경채%채소류%2개&칵테일새우 또는 자숙새우%수산물%1컵&다진대파%기타%2큰술&다진마늘%기타%1/2큰술&식용유%기타%2큰술&참기름%기타%1/2큰술&간장%기타%1작은술&굴소스%기타%1작은술&설탕%기타%1/3작은술&물%기타%1큰술&전분가루%기타%1/3작은술&,*청경채는 밑둥을 자르고 한잎씩 떼어주세요. *냉동 칵테일새우은 해동해 주세요. *위의 분량의 양념을 넣고 섞어서 간장소스를 만들어주세요. *대파는 송송 썰어주세요.%팬에 식용유를 두르고 다진마늘과 대파를 넣고 볶아주세요.(2~3분정도)%새우도 넣고 볶아주세요.(1~2분정도)%청경채를 넣고 볶아주세요. 숨이 죽으면%간장 소스를 넣고 섞어주세요.%참기름을 두르고 완성그릇에 담아주세요.,간편추구형%모험추구형
저녁반찬 없을때 후다닥 참치감자조림,2인분,10분 이내,아무나,6892715,밑반찬,조림,초스피드,참치%가공식품류%1캔&감자 작은거%곡류%2개&양파%기타%1/2개&대파%기타%1줌&매콤하게 먹고싶으면 청양고추%기타%1꼬집&고추장%기타%1스푼&고춧가루%기타%1스푼&간장%기타%1스푼&다진마늘%기타%1스푼&설탕%기타%1스푼&물%기타%200ML&후추%기타%톡톡&,감자와 양파는 먹기좋게 썰어주세요%뚝배기(냄비)에 감자와 양파를 넣고%양념장은 미리 섞어주세요%참치는 기름기를 뺀뒤 올려주고%대파도 올려줘요(매운거 좋아하시면 청양고추도 한꼬집)%잘섞인 양념장은%냄비에 붓고 물도 넣어서 푹 끓여줍니다%너무 휘저으면 참치가 으깨지기는 하는데 어차피 밥 비벼먹을거면 상관없어요! ㅎㅎ 끓이기만 하면 완성 입니다!,간편추구형%건강/안전추구형%합리추구형
햄 숙주볶음 : 초간단 밥반찬&amp;술안주,2인분,15분 이내,아무나,6879416,밑반찬,볶음,일상,숙주%채소류%1봉지(250g)&채썬 햄%가공식품류%1/2~1주먹&다진 파%기타%1주먹&청양 고추%기타%1개&굴소스%기타%1/2~1T&후추%기타%조금&식용유%기타%1T&참기름%기타%1t&깨%기타%조금&,숙주는 깨끗하게 씻어서 채반에 물기를 빼주세요.%대파를 얇게 썰어 준비 하세요%햄을 베이컨처럼 얇게 채 썰어 주세요. *뜨거운 물에 살짝 담갔다가 빼서 사용 하셔도 좋아요(기름기 제거)%청양고추를 적당한 크기로 어슷 썰어주세요.%식용유에 파를 넣은 다음 중약불로 볶아 주세요.%파향이 나기 시작하면 햄  고추를 넣고 익을랑 말랑 할때까지 볶아 주세요(중불) 중간에 햄의 냄새가 싫다면 후추를 한번 톡! 뿌려주세요.%센불로 올려서 숙주와 굴소스를 넣고 빠르게 볶아주세요(살짝 익을랑 말랑 할때까지만!)%불을 끈 뒤 참기름을 넣고 잔열로 빠르게 볶다가 얼른 접시로 옮겨주세요 (뜨거운 열에 숙주를 계속 두면 숨이 죽어요)%접시에 담고 깨를 솔솔 뿌려주세요.,간편추구형%합리추구형
엥 이거 완전 꿀조합 아니냐.. 오레오 치즈케이크 만들기!,6인분 이상,5분 이내,아무나,6873390,빵,굽기,초스피드,크림치즈%달걀/유제품%200g&설탕%기타%30g&달걀%기타%1개&우유%기타%2Ts&,오레오를 믹서로 가볍게 부수어 3분의 2를 케이크 틀에 넣는다.%상온에 둔 크림치즈를 믹서에 넣고  설탕  계란  우유와 함께 질퍽해질 때까지 섞는다.%1위에 2를 넣고 마지막에 나머지 오레오를 얹는다.%오븐 180도에서 30분 구워 색이 들면 OK.%v열기가 사라진 후 냉장고에 하룻밤 두면 완성입니다 ♪,간편추구형%모험추구형
저염식 고구마빵 NO오븐 NO밀가루 간편하게 전자렌지로,2인분,15분 이내,아무나,6906441,빵,기타,다이어트,고구마%곡류%2개&계란%달걀/유제품%2개&우유%기타%1큰술&,고구마2개를 쪄서 식혀주세요%고구마 껍질을 벗기고 으깨어 주세요 계란은 노른자만 두개 고구마랑 섞어 주세요%우유 한큰술 넣어 주세요 많이 넣으면 안되요%흰자는 이렇게 따로 준비해주세요%거품기로 머랭을 칩니다%고구마와 머랭을 섞어주세요%깊이가 깊지 않는 사기그릇이나 접시에 고구마를 고르게 펴서 준비해주세요 전자렌지용으로 그릇을 준비해주세요%랩을 씌우고 포크로 구멍을 두군데쯤내어 주세요 전자렌지에 3분간 돌려 주세요 죽처럼 반죽이 되신분은 전자렌지를 조금 더 돌려주셔야해요 저는 된직하게 만들어서 3분에서 4분이면 충분하더라구요 (전자렌지 출력에 따라 조금씩 틀려질수 있어요)%완성된 고구마빵 소금도 설탕도 넣지 않았어요 계란때문에 간이 간간이 잘되어 맛있어요%고구마빵 우유와 함께 드셔보세요 https://seunmi1981.tistory.com/,간편추구형%합리추구형
너무 간단한 베이킹~블루베리 크럼블 타르트 에요~^^,4인분,60분 이내,초급,6832551,과자,굽기,간식,박력분%제과/제빵%160g&아몬드가루%콩/견과류%40g&버터%달걀/유제품%100g&설탕%기타%90g&소금%기타%2g&냉동블루베리%기타%1컵정도&,아몬드가루와 밀가루는 체에 한번 내려주고 설탕과 소금을 넣어 고루 잘 섞어준다%. 버터를 넣고 주걱으로 자르듯이 섞어준다%전 도우블랜더가 있어서 주걱대신 사용했습니다%어느정도 버터가 잘게 잘라지면 손으로 날가루가 보이지 않게 반준해준다%보슬보슬 반죽이 되면 끝%타르트 틀에 반죽한 가루중 2/3 를 넣고 꾹꾹 눌러준다%블루베리를 고루 넣어준다 (전 모듬베리로 한개 더 준비해 봤어요~^^*)%나머지 반죽을 위에 뿌려준다%180도로 예열한 오븐에서 30분정도 구워준다 (각자 오븐 온도 살피시고 구워지는 색을면서 구워주세요~)%완성~!! 꺼내서 식혀주세요,합리추구형%모험추구형
고추장삼겹살 짱맛 양념,2인분,60분 이내,아무나,6838588,메인반찬,굽기,손님접대,삼겹살%돼지고기%300-400g&양파%기타%&고추가루%기타%1T&고추장%기타%1T&간장%기타%1T&설탕%기타%1T&올리고당%기타%1T&미림(or청주)%기타%1T&다진마늘%기타%1T&참기름%기타%1T&,분량의 양념을 모두 넣어 미리 양념장을 만들어주세요%준비 된 생삼겹살에 양념장을 넣어 버무린 후 최소 30분이상 냉장고에서 숙성시켜주면 좋아요%그 사이 양파는 채썰어서 매운맛을 제거하기 위해 찬물에 담궈주세요%냉장고에서 숙성을 마친 양념삼겹살은 달궈진 팬에 중약불에서 구워주세요%양념이 된 고기기 때문에 쉽게 탈 수 있으니 불조절을 해주시면서 겉은 타지 않고 안쪽까지 익을 수 있도록 구워주세요%물기를 제거한 양파를 접시에 깔고 잘 구워진 고추장삼겹살을 적당하게 잘라 양파위에 올려주면 완성!,합리추구형
[간단한 간식만들기]마늘버터떡볶이 길릭떡볶이 간장떡볶이,2인분,10분 이내,아무나,6861965,밥/죽/떡,볶음,간식,밀떡%쌀%200g&통마늘%채소류%10개&버터%기타%2스푼&식용유%기타%적당량&간장%기타%2스푼&설탕%기타%1스푼&,[간단한 간식만들기]마늘버터떡볶이 길릭떡볶이 간장떡볶이 조리시간 : 15시간 조리분량 : 2인분 난이도 : ★☆☆☆☆%재료: 밀떡 200g  통마늘10개 버터2스푼 식요유 간장2스푼 설탕1스푼%냄비에 물을 넣고 떡볶이떡을 1분간 데쳐줍니다.%데친떡은 찬물에 헹구어 준뒤 체에 걸러 물기를 제거해주세요.%통마늘을 준비해서 슬라이스채칼로 편을 썰어 준비합니다.%후라이팬에 기름을 넣고 튀기듯 편마늘을 볶아주세요.%마늘이 노릇노릇해지면 키친타올에 올려 기름을 빼줍니다.%후라이팬에 버터 2스푼을 넣고%물기를 제거한 떡볶이 떡을 넣고 튀겨줍니다.%어느정도 볶다가 간장2스푼 설탕1스푼을 넣고 볶아주면 끝이예요. 짭쪼름한것이 싫으신 분들은 간장을 1스푼만 넣어주세요.%간장에 볶은 떡을 그릇에 담고 마늘튀긴것을 올려 파슬리가루를 뿌려주면 마늘버터 떡볶이 완성입니다!,간편추구형%모험추구형
이거 된장으로 만든거 맞음?존맛ㅠㅠ 된장삼겹살덮밥,1인분,30분 이내,초급,6873881,밥/죽/떡,볶음,일상,대패 삼겹살%돼지고기%200g&양파%기타%1/2개&대파%기타%1대&밥%기타%1공기&식용유%기타%약간&설탕%기타%1T&간장%기타%1/2T&맛술%기타%1T&된장%기타%1T&다진 마늘%기타%1/2T&올리고당%기타%1T&참기름%기타%1T&물%기타%2T&,"양파는 채 썰고 대파는 송송 썰어 준비한다.%<p class=""step_add add_material"">양파 1/2개  대파 1대</p>%볼에 양념 재료를 넣고 양념장을 만든다.%<p class=""step_add add_material"">[양념] 설탕 1T  간장 1/2T  맛술 1T  된장 1T  다진 마늘 1/2T  올리고당 1T  참기름 1T  물 2T</p>%양념장에 고기를 넣고 잘 버무린다.%<p class=""step_add add_material"">대패 삼겹살 200g</p>%팬에 식용유를 두르고 양파를 넣어 볶는다.%<p class=""step_add add_material"">식용유 약간</p>%<p class=""step_add add_tool"">팬</p>%양파가 살짝 익으면 양념된 고기를 넣고 익힌다.%고기가 다 익으면 밥 위에 고기를 올린 후 대파를 뿌린다.%<p class=""step_add add_material""> 밥 1공기</p>",합리추구형
