봄동된장무침,4인분,30분 이내,아무나,6928051,밑반찬,무침,일상,봄동%채소류%300g&대파%채소류%적당량&된장%기타%1큰술&고추장%기타%1/2큰술&들기름%기타%2큰술&다진마늘%기타%1/2큰술&통깨%기타%&,굵은소금 반큰술넣고 살짝 데쳐준다%찬물에 충분히 헹궈 물기를 꼭 짜준다%먹기좋게 썰어 볼에 담고%대파 다져넣고 분량의 양념을 모두 넣은 뒤%조물 조물 무쳐 그릇에 담아낸다
달콤 짭조름♡ 떡 베이컨 간장조림♡,3인분,5분 이내,아무나,6843136,밑반찬,조림,초스피드,베이컨%가공식품류%&대파%채소류%&떡%쌀%&간장%기타%&참기름%기타%&물엿%기타%&기름%기타%&,대파에 떡국떡 (가래떡 떡볶이떡) 베이컨%기름두르고 볶듯구워요.(튀기듯하면 더 맛있습니다)%간장.물엿.참기름을 넣어 볶아요. 간장 한스푼 물엿 넉넉히 참기름한스푼(이런 느낌 비율로. )%볶아주며 졸입니다.%국물없게끔 졸여야 맛있어용: )%깨도 뿌리고 한번 볶아준 후 끝.%완성^^
매운 팽이버섯 조림 간단 반찬/술안주/맥주안주/소주안주 굿굿!!,1인분,5분 이내,아무나,6927971,메인반찬,조림,술안주,팽이버섯%버섯류%1봉지&고추장%기타%1스푼&진간장%기타%1스푼&설탕%기타%1스푼반&다진마늘%기타%1스푼&물%기타%2스푼&,팽이버섯 밑둥을 자르고 한입 크기 덩어리로 분리해줍니다%팬에 기름을 두르고 팽이버섯을 앞뒤로 30초씩 구워 줍니다%<p class=step_add add_fire>강불</p>%분량의 소스를 팽이버섯 위에 부어 줍니다%앞뒤로 30초씩 조려 주면 완성!
부타동 : 일본식 돼지고기 덮밥 간단한 점심 메뉴로 굿!,1인분,30분 이내,초급,6902207,밥/죽/떡,볶음,일상,대패삼겹살%돼지고기%200g&양파%채소류%1/2개&달걀 노른자%달걀/유제품%1개&설탕%기타%1큰술&간장%기타%1.5큰술&맛술%기타%1큰술&설탕%기타%1큰술&다진마늘%기타%1작은술&,먼저 양파는 1/2개만 썰어주세요. 부타동은 별다른 야채들이 필요없어요. 간단하게 양파만 가지고 만들 수 있어서 자취생들도간단하게 만들수 있습니다.%그 다음 양념장을 만들어줍니다. 간장 1.5큰술 맛술 1큰술 설탕 1큰술 다진마늘 1작은술을 넣고 잘 섞어주세요. 원래 다진마늘 대신 생강을 넣어주는데요. 생강이 없어서 저는 다진마늘로 대체 했습니다.%그 다음 후라이팬에 대패삼겹살 200g을 넣고 설탕 1큰술 넣고 볶아줍니다.%<p class=step_add add_tip2> 고기를 볶을때 설탕을 넣으시면 <br> 소스도 더 잘베이구요. 고기의 감칠맛을 살려줍니다.</p>%설탕이 다 녹으면 양파를 넣어주시구요. 그리고 소스도 같이 넣어줍니다.%저는 소스가 있는거 보다는 바싹 굽는게 좋더라구요. 소스가 자작하게 남아있는게 좋으신 분들은 취향에 따라 맛있게 구워주시구요.%고기가 다 익으면 밥위에 먹음직 스럽게 고기를 올려주세요.%그리고 마지막으로 가운데에 달걀 노른자 1개를 올려줍니다. 달걀의 비린맛 때문에 날달걀을 못드시는 분이라면후라이 1개 해서 올려주시구요.%마지막으로 파슬리 가루 뿌려주시면 맛있는 부타동 완성입니다. 생각보다 만들기 너무 간단하구요. 확실히 일본식이라 그런지 많이 자극적이지 않구요. 고기의 달콤 짭짤함과 노른자의 담백함이 어울려져서 맛있는 한끼로 손색없었습니다.
자취라이프 평범한 단무지도 양념에 무쳐서 맛있게 먹자,3인분,10분 이내,초급,6840157,밑반찬,무침,일상,단무지%가공식품류%260g&대파 손가락 길이%채소류%1줄&통깨%기타%1숟가락&고추가루%기타%1숟가락&참기름 또는 들기름%기타%1숟가락&올리고당%기타%1숟가락&,재료를 준비합니다. 단무지 1팩 대파를 짧게 어슷 썰어줍니다.%그릇에 통깨를 1숟가락 넣어줍니다.%꿀 뜨는 도구로 깨를 빻아줍니다. (통깨는 몸에 흡수가 많이 되지 않아 빻아서 드시는게 몸에 더 흡수가 되어서 으깨 먹습니다.%볼에 깨를 으깨서 넣고 고추가루1숟가락을 넣습니다.%참기름 또는 들기름 1숟가락을 넣어줍니다. 저는 고소한 참기름을 좋아해요~ 들기름이 몸에는 더 좋다고 합니다.%올리고당을 1숟가락 조금 안되게 넣어 줍니다.%잘라 놓은 대파를 넣어 줍니다.%단무지는 입맛에 맞게 잘라줍니다. 저는 반달 모양을 반으로 잘라줬어요. 동그란거의 1/4 모양이라고 생각 하심 됩니다.%양념장에 물기를 짜서 넣어줍니다.%양념과 대파가 어우러지게 무쳐줍니다.
고소하고 상큼한 일본식 오이토마토무침,2인분,20분 이내,아무나,6930302,밑반찬,무침,일상,오이%채소류%1개&완숙토마토%채소류%1개&꽃소금%기타%약간&설탕%기타%2작은술&깨소금%기타%2큰술&현미식초%기타%2작은술&양조간장%기타%1큰술&참기름%기타%1작은술&,오이와 토마토는 깨끗이 씻어 주고 (토마토가 작아서 두개 했어요) 오이 표면에 있는 오돌도톨한 부분을 살짝 제거 해 주세요%오이는 반으로 잘라서 씨를 제거 해 주고 ~%오이는 1.5cm 정도로 썰어 주고 ~%꽃소금 약간 넣어 섞어 준 다음 10분 절임 하고 ~%키친타올에 수분기 제거 하고 ~%볼에 담아 주세요%토마토는 십자로 썰어 주고 다시 반으로 잘라서 ~%씨를 제거 해 주세요%양념 만들어 주고 ~%깨소금은 바로 곱게 갈아 주면 더 맛있어요%양념은 잘 섞어 주세요%볼에 오이와 토마토 담아 주고 ~%양념 넣어 주고 ~%살살 버무려 주면 됩니다%접시에 담아 주고 ~
비건 아몬드쿠키★,2인분,60분 이내,아무나,6938309,과자,굽기,영양식,바나나%과일류%1개&아몬드%콩/견과류%200g&베이킹 파우더%기타%1/2큰술&,아몬드를 정량 준비해 분쇄해주세요.%<p class=step_add add_tip2>너무 곱게는 말고 그 직전까지만 분쇄해주세요.</p>%바나나 하나를 으깨줍니다.%으깬 바나나에 분쇄한 아몬드와 뮤즐리를 부어줍니다.%베이킹 파우더와 시럽을 첨가한후 되직하게 잘섞어줍니다.%<p class=step_add add_tip2>너무 무른 반죽이 되지 않도록 주의해주세요!<br> 스푼으로 떠질 수 있을 정도의 반죽이 제일 좋아요^^</p>%종이호일 위에 반죽을 한스푼씩 떠서 눌러주고 오븐에서 140도 30분 정도 굽습니다.%노릇해지면 꺼내서 식혀줍니다.%바삭 쫀득 고소 건강하고 맛있는 쿠키 완성!!!
[반찬] 숙주새우달걀볶음,2인분,15분 이내,아무나,6847884,밑반찬,볶음,초스피드,숙주%채소류%2-3줌&달걀%달걀/유제품%1-2개&새우%해물류%10-12마리&양파%채소류%1/2개&청양고추%기타%1-2개&쪽파%기타%1줌&굴소스%기타%2T&간장%기타%1-1.5T&다진마늘%기타%1T&참기름%기타%0.5T&후추%기타%약간&통깨%기타%약간&청주%기타%1T&소금%기타%톡톡&후추%기타%톡톡&,재료를 준비해 주세요. 숙주는 깨끗이 씻어 준비하고 양파 청양고추 쪽파는 적당한 크기로 썰어주세요. 달걀은 잘 풀어서 준비해주세요.%분량의 양념장을 모두 잘 섞어 준비해주세요.%<p class=step_add add_tip2>단맛을 위해 설탕이나 올리고당 살짝 추가하셔도 좋아요</p>%새우는 청주 1T 소금 후추를 조금씩 넣어 버물버물 해주세요.%팬에 기름을 두르고%약불에서 달걀물을 부어 스크램블을 만들어 주세요. 살짝만 익힌 후 접시에 따로 담아두세요.%스크럼블 만든 팬에 그대로 기름을 조금 추가하고 양파 넣고 약 1분간 센불에서 볶아주세요.%그 다음 새우를 넣어 약 4-5분간 새우가 익을때까지 볶아주세요.%새우가 익으면 숙주를 듬뿍 올리고 양념장을 넣어주세요.%그리고 아까 만들어둔 스크럼블 에그 대파 청양고추를 넣어 약 1-2분간 뒤적거리다 불을 꺼주세요. 간보고 싱거우면 소금을 살짝 추가해주세요.
에어프라이어 진미채 버터구이 맛있게 만드는법,2인분,5분 이내,아무나,6938414,디저트,굽기,간식,진미채%건어물류%2주먹&후추%기타%약간&파슬리가루%기타%약간&버터%기타%3T&설탕%기타%1t&,진미채버터구이 만드는법.진미채 버터구이 레시피를 소개해 드릴께요.%진미채 2주먹.후추약간.파슬리가루 약간.버터3T.설탕1t.준비 해 주세요. 미리 녹여둔 버터를 넣어 주시구요%후추도 넣어 주세요.%그리고 설탕도 넣고 파슬리 가루 있으심 솔솔 뿌려 주세요. 그리고 잘 버무려 주세요. 버터가 골고루 뭍도록 잘 버무려 주세요.%그리고 종이 호일을 깔고 잘 펼쳐서 넣어 주세요. 에어프라이어 180도 3분만 돌리면 끝%버터향 솔솔 영화관에서 먹던 오징어버터구이 바로 그맛
♥[신혼밥상] 10분 반찬! 메추리알조림,4인분,15분 이내,초급,6916408,밑반찬,조림,초스피드,메추리알%달걀/유제품%270g&스팸%가공식품류%1/2캔&청양고추%기타%1~2개&올리고당%기타%1바퀴&다진마늘%기타%1커피스푼&참기름%기타%1스푼&통깨%기타%적당히&간장%기타%6스푼&설탕%기타%1.5스푼&맛술%기타%2스푼&물%기타%1종이컵&,메추리알과 스팸하나면 반찬걱정 끝!%스팸 반캔 또는 1캔 네모네모 잘라주세요.%간장 6스푼을 넣어주세요.%<p class=step_add add_tip2>(선택재료) 맛술2스푼 감칠맛 추가</p>%설탕 1스푼 반을 넣어주세요.%물은 종이컵1잔 분량 붓기.%다진마늘 커피스푼1 매콤한 맛을 좋아한다면 청양고추 또는 꽈리고추 추가 아이를 위한 반찬이라면 이 단계 생략!%7분~8분 동안 졸여주세요.%가스불 끄기 직전 올리고당 한바퀴 빙 둘러주시고 참기름 1스푼 통깨 뿌리면 초간단 반찬 완성!
백종원의 부추 달걀 볶음,2인분,15분 이내,아무나,6891606,밑반찬,볶음,일상,부추%채소류%1줌&달걀%달걀/유제품%4개&식용유%기타%2큰술&밥%기타%2공기&굴소스%기타%1큰술&참기름%기타%1큰술&,부추는 적당한 크기로 썰고 달걀은 여러번 저어서 곱게 풀어 놓습니다%팬에 식용유를 두르고 뜨거워지면 달걀을 붓고 젓가락으로 저으면서 익혀주세요%부추와 굴소스를 넣고 볶아주세요%달걀과 섞은후 불을 끄고 참기름을 넣고 저어준후%그릇에 밥 한공기를 담고 그위에 부추 달걀 볶음을 담아주세요.