호텔에서 배운 초코칩쿠키 레시피 : chocolate chip cookie | 안젤라 베이킹,6인분 이상,2시간 이상,아무나,6925791,과자,굽기,간식,버터%달걀/유제품%190g&설탕%기타%283g&계란%달걀/유제품%180g&박력분%제과/제빵%350g&코코아 파우더%기타%125g&베이킹파우더%기타%3g&소금%기타%3g&초코칩%가공식품류%200g&,박력분 코코아파우더 베이킹파우더는 3번 체 쳐서 준비한다.%버터에 설탕 소금을 넣고 저속 또는 중속으로 1-2분 휘핑하며 크림화 시킨다.%계란도 넣고 중속으로 2-3분간 더 휘핑한다.%체 쳐 둔 가루를 넣고 섞어준다.%날가루가 보이지 않을 때 쯤 초코칩을 넣고 섞는다.%종이호일에 반죽을 올려서 원하는 크기의 원통으로 만들어 종이호일로 감싸 냉장고에서 2시간 이상 휴지시킨다.%종이호일을 벗기고 1cm 두께로 썰어 실리콘페이퍼를 깐 오븐팬에 팬닝한다.%170도로 예열된 오븐에서 15분 구워준다.,합리추구형
호박참치볶음(담백하니 아기도 좋아해요~),3인분,30분 이내,초급,6905452,밑반찬,볶음,일상,애호박%채소류%1대접&양파%채소류%1/4개&마늘%기타%1숟가락&참치%가공식품류%1캔(작은거)&굴소스%기타%1숟가락&소금%기타%조금&,애호박 참치캔을 준비해요%달군 팬에 호박넣고 굴소스 마늘을 넣어요%골고루 잘 볶아요 70%정도 익었을때%양파 깍두기모양으로 썬것과 참치캔을 넣어서 볶아요%골고루 잘 섞으면 끝입니다 부족한 간은 소금으로 해요%예쁘게 담아요,건강/안전추구형%합리추구형
아삭한 풋고추 무침 만들기,2인분,10분 이내,아무나,6878407,밑반찬,무침,일상,풋고추%채소류%7~9개&된장%기타%1큰술&고추장%기타%1/3큰술&다진마늘%기타%1/2큰술&올리고당%기타%1/2큰술&매실청%기타%1큰술&참기름%기타%1/2큰술&깨소금%기타%약간&,우선 풋고추는 깨끗이 씻어서 먹기 좋은 크기로 썰어 주세요.%다진마늘 1/2큰술에 매실청 1큰술 넣고%된장 1큰술 고추장 1/3큰술 참기름 1/2큰술 올리고당 1/2큰술 깨소금 넣어 잘 섞어주세요.%미리 썰어놓은 풋고추를 넣고%조물조물 버무려 주면~풋고추 무침 완성!,간편추구형%건강/안전추구형%합리추구형
김구이와 달래양념장만있으면 밥한공기 뚝딱!,4인분,15분 이내,아무나,6842110,밑반찬,굽기,일상,달래%채소류%1/2줌&홍고추%기타%1/2개&구운김%수산물%적당량&간장%기타%10T&참기름%기타%1T&깨%기타%1T&매실청%기타%3T&마늘%기타%1/2T&고추가루%기타%1T&,김을 굽는 방법은 아주 간단해요 후라이팬을 가열한뒤 열이 올라오면 약불로 줄여준다음 김을 올려서 앞뒤로 구워주시면 됩니다.%왼쪽이 안구운쪽 오른쪽이 후라이팬에 구운쪽이예요 형광등에 비쳐봤을때 저렇게 거뭇거뭇했던 김이 초록초록해지면 김구이가 잘된거예요.%구운김을 가지런히 놓고 칼이나 가위를 이용해서 먹기 좋게 잘라줍니다%구운김은 밀폐용기에 담아서 보관하면 오래두고 먹을수 있어요.%자 이제 김이 다구워졌으니 김구이와 함께 먹을 달래양념장을 만들께요 마트가니까 저렇게 한묶음씩 팔더라구요~한줌보다는 반줌정도 되는양같아요~ 요거랑 홍고추1/2개를 준비합니다.%달래는 처음사시면 고무줄로 묶어져 있는데 묶어져 있는 상태로 뿌리쪽을 물로 헹구어준다음 고무줄을 풀러서 흐르는물에 깨끗하게 헹구어 주세요.%헹구어진 달래를 0.5cm정도 크기로 곱게 다져주시고 홍고추도 씨를 제거후에 잘게 다져서 준비해주세요.%큰볼에 달래와 홍고추를 넣고 %간장10스푼 참기름1스푼 매실청3스푼 고추가루1스푼 다진마늘1/2스푼 통깨1스푼을 넣고 %잘섞어줍니다. (양이 꽤많이 나오므로 두고두고 드실수 있어요)%달래양념장도 완성이 되었어요.%미리 넉넉하게 김도 굽고 양념장도 만들어 두었다가 ~ 아침에 먹고 가셔도 좋고~ 입맛없을때 요렇게만 해서 먹어도 참 맛있어요.,간편추구형%건강/안전추구형%합리추구형
정말 쉬운 감자간장조림~~실패율 0%!!!당장 도전입니당♡♡♡,3인분,30분 이내,초급,6896724,밑반찬,조림,일상,감자%채소류%3개&양파%채소류%조금&다진파(생략가능)%기타%조금&간장%기타%3숟가락&물엿%기타%4숟가락&식용유%기타%2숟가락&통깨%기타%넉넉히&,감자를 깍두기로 썰어요 넘 크지 않아야 양념이 잘 배어들어요%물에 헹궈서 전분기를 빼줘요%간장.물엿.식용유를 먼저 넣고(물을 먼저 넣고 양념을 넣으면 한강이 될 수 있어요)%물은 자작한 정도까지 붓고%뚜껑 덮고 10분정도 끓여요%10분 졸이면 물이 요정도%뚜껑열고 5분 정도 더 졸여요~~개인취향에 따라 진한 색을 좋아하면 타지 않게 팬을 흔들면서 색깔을 내요%깨범벅을 해야 맛있어요~,건강/안전추구형%합리추구형
메추리알소세지볶음,4인분,15분 이내,초급,6933999,밑반찬,볶음,영양식,메추리알%달걀/유제품%1봉&소세지%가공식품류%1봉&청양고추%채소류%2~3개&양파%채소류%1/2개&고추장%기타%1.5스푼&진간장%기타%1.5스푼&케찹%기타%4스푼&설탕%기타%2스푼&물%기타%6스푼&,먼저 분량의 양념을 다 섞어주세요 매운맛을 좋아하신다면 고추장을 1.5스푼 아이들이 먹을거라면 1스푼만 넣어주셔도 될 것 같아요 또 간을 보고 새콤한 맛이 더했으면 좋겠다 싶으면 케찹을 좀 더 넣어주세요%소세지는 칼집을 내서 준비해요 양은 1봉에서 2봉 넉넉히 넣어주세요 저는 1봉지 밖에 없어서 메추리알이 좀 더 많았는데 소세지도 넉넉히 넣어주면 더 좋겠다 싶었어요%기름 두른 팬에 소세지를 넣고 칼집이 잘 벌어지도록 구워줍니다%어느정도 익어가면 메추리알과 양파 청양고추를 썰어 넣어 볶아주세요 저는 3개정도 넣어 매콤하게 즐겼는데 이 또한 갯수는 입맛에 맞게 조절해주세요 아이들이 먹을거라면 패스해도 좋고 1개만 넣어주셔도 좋아요 :)%전체적으로 잘 익으면 만들어둔 소스를 넣어 같이 볶아주세요 이때 재료들이 다 익었기 때문에 오래 볶을 필요 없이 양념이 고루고루 잘 섞었는지 보고 불을 꺼주시면 되요%접시에 담아 통깨 뿌려주면 메추리알 요리 너무 먹음직스럽죠?,간편추구형%합리추구형
깔끔매콤 차돌박이 숙주찜,3인분,10분 이내,초급,6893869,메인반찬,찜,초스피드,차돌박이%소고기%1팩&숙주나물%채소류%600g&청양고추%기타%5개&간장%기타%3T&굴소스%기타%2T&소금%기타%약간&후추%기타%약간&참기름%기타%1T&,차돌박이 숙주 청량고추를 준비하세요.%차돌박이에 소금 후추를 뿌리고 중불에서 가열합니다. 2/3 정도만 익혀야 부드럽습니다.%2/3 익은 고기에 숙주를 얹고 뚜껑 덮고 약불에서 5분 정도 익힙니다.%청량고추를 넣구요.%밥숟가락으로 굴소스와 간장을 넣고 섞어줍니다.%약간의 소금과 참기름을 넣고 비벼주면 완성!!!%그릇에 예쁘게 담아 드세요. 국물까지 맛있어요^^,간편추구형%건강/안전추구형%모험추구형
알찜 만들기 :: 소주 1병각! 최고의 술안주 레시피,3인분,20분 이내,초급,6933628,메인반찬,볶음,술안주,명태알%수산물%500g&콩나물%채소류%250g&대파%채소류%15cm&소금%기타%1큰술&설탕%기타%1큰술&고춧가루%기타%4큰술&맛술%기타%2큰술&멸치액젓%기타%1큰술&간장%기타%5큰술&굴소스%기타%3큰술&다진마늘%기타%1큰술&,먼저 대파 15cm 정도 준비해서 송송 썰고 콩나물 250g 헹궈서 준비해주세요. 콩나물은 더 많이 넣는걸 추천!! 콩나물 양이 살짝 부족했어요!!%다음은 양념장을 만들어주세요. 설탕 1큰술 고춧가루 4큰술 맛술 2큰술 멸치액젓 1큰술 간장 5큰술 굴소스 3큰술 다진마늘 1큰술%끓는물에 소금 1큰술을 넣고 명태알과 이리를 넣고 5분간 데쳐주세요.%5분 후 명태알과 이리는 채에 건져서 찬물에 살짝만 헹궈주세요.%팬에 식용유를 두르고 대파를 넣고 1분간 볶아서 파기름을 만들어 줍니다.%그 후 한번 데친 알과 이리를 넣고 같이 볶아주세요. 이미 데쳐서 익었기 때문에 1분정도만 볶아주면 됩니다.%그 다음 콩나물을 넣고 양념장 3큰술을 넣고 볶아주세요.%콩나물 숨이 다 죽으면 남은 양념장을 넣고 다시 한번 더 볶아주세요.%마지막으로 후추 살짝 뿌려주면 완성입니다.,합리추구형
계란덮밥- 아이가 좋아하는 연두부와 달걀의 만남 부드러운 계란덮밥,2인분,15분 이내,아무나,6855421,밥/죽/떡,볶음,영양식,계란%달걀/유제품%3개&연두부%콩/견과류%2개&치즈%달걀/유제품%1장&소금%기타%1/2수저&들기름%기타%약간&후추%기타%살짝&,계란을 볼에 넣어 풀어준다~!%소금 반 수저를 넣어 풀어준다~!%연두부 2개를 넣어 섞어주고~!%약불에서 스크램블 만들듯이 뭉근해지면 한번 젖고~ 뭉근해지면 한 번 젖고~!%계란이 살짝 익을 때쯤에 치즈도 찢어 넣어준다~! 마지막에 후추 살짝~!%밥공기에~ 밥을 담고 그 위에 소복이 계란을 덮어주고 들기름 살짝 뿌려주면 완성~! 계란덮밥도 부드럽지만 연두부가 들어가서 훨씬 촉촉하고 부드럽다.율양은 평소보다 많은 양을 뚝딱해치워주셨다~이쁜 내 새끼 ♥ 연두부를 넣어서 왠지 더 몸에 좋을 것 같은 든든한 한 끼!,간편추구형%건강/안전추구형
고소한 콩가루 스콘 ! 비건레시피 노버터 스콘,4인분,60분 이내,아무나,6929074,디저트,굽기,일상,박력분%제과/제빵%120g&콩가루%곡류%30g&설탕%기타%40g&베이킹파우더%기타%7g&가당 두유%기타%60g&카놀라유%기타%30g&식초%기타%4g&,볼에 박력분+콩가루+설탕+베이킹파우더를 넣고 골고루 섞어 주세요%두유+카놀라유+식초를 볼에 넣고 포크로 오일방울이 잘아지도록 섞어 줍니다.%가루류중앙에 액체재료를 모두 넣고 주걱으로 섞어주세요.%날가루가 어느정도 없어질때까지 섞어줍니다.%뭉쳐진 반죽은 여러차례 포개어 접어 주시고 %스크래퍼로 분할하여 팬닝합니다.%190도 예열된 오븐에서 12분 -15분 가량 구워 냅니다. [오븐사양마다 차이가 있으니 구움색을 잘 확인 해주셔야 합니다.],모험추구형
달걀(계란) 숙주볶음 : 초간단 반찬 겸 술안주,2인분,10분 이내,아무나,6881913,밑반찬,볶음,일상,달걀%달걀/유제품%3개&숙주%채소류%250g(1봉지)&후추%기타%톡톡&굴소스%기타%2T&식용유%기타%4~5T&참기름%기타%조금&다진 쪽파%기타%1/2T(생략가능)&,숙주는 깨끗하게 씻어서 채반에 올려서 물을 빼주세요.%쪽파는 아주 작게 송송 썰어주세요.(생략 가능)%달걀에 후추를 톡톡 넣고 잘 풀어주세요.%식용유를 넣고 달군 팬에 달걀을 넣고 센불에서 빠르게 튀기듯 볶아주세요. 저는 식용유가 살짝 부족해서ㅜ 스크램블이 됐네요;;%물기를 뺀 숙주와 굴소스를 넣고 빠르게 볶아주세요*저는 굴소스눈 2T 넣었어요. 간 조절 해주세요!%살짝 숨이 죽어갈때 불을 끄고 참기름을 1t정도 넣고 섞어주세요원하는 숙주의 식감을 맞춰주세요~%접시에 옮긴 뒤 쪽파를 뿌려주세요. 완성♡,간편추구형%합리추구형%모험추구형
계란말이케이크,3인분,20분 이내,중급,6938068,밑반찬,굽기,손님접대,계란%달걀/유제품%8개&카놀라유%기타%2~3T&빨강파프리카%기타%1T&노랑파프리카%기타%1T&다진당근%기타%1T&다진파%기타%2T&다진양파%기타%1T&맛소금%기타%1/2ts&설탕%기타%1ts&맛소금%기타%1/3ts&설탕%기타%2/3ts&참기름%기타%1ts&케찹%기타%&어린잎%기타%&,"계란은 8개 준비해 주세요. 계란말이가 어느정도 도톰해야 케이크 모양이 예쁘게 나오기 때문에 6개 이상 사용하시는게 좋아요. 넓은볼 두개를 준비해 계란 흰자와 노른자를 나눠줍니다.%계란흰자 노른자에 위 분량만큼 맛소금 설탕 참기름을 넣고 젓가락으로 잘 섞어줍니다. 흰자는 알끈을 잘 풀어가며 섞어주세요.%<p class=""step_add add_tip2"">참기름은 노른자에만 넣어줍니다</p>%당근 피망 양파 파는 잘게 잘게 다져줍니다. 약간의 색감을 위한거라 1스푼정도 씩이면 충분해요. 꼭 이재료가 아니더라도 냉장고에 있는 색감있는 자투리 야채 활용해주시면 됩니다^^%잘게다진 야채는 흰자에 모두 넣고 잘 섞어줍니다.%<p class=""step_add add_tip2"">야채는 노른자에 넣지 않아요!! 흰자에 모두 넣어주세요.</p>%계란말이 팬에 기름을 살짝 두르고 사진처럼 키친타올로 닦아주세요.%<p class=""step_add add_tip2"">계란말이는 기름양과 불조절이 제일 중요해요.</p>%키친타올로 닦아내고 이 사진처럼 팬에 살짝 묻어있는 정도의 양만 남겨주세요. 도톰하게 하려고 팬의 좁은면을 앞으로 오게 해서 만들었어요.%<p class=""step_add add_tip2"">기름이 너무 많거나 불이 세면 계란이 튀겨지기 때문에 모양이 울퉁불퉁 하거나 겉면이 노릇노릇해져요</p>%팬이 예열되면 불을 제일 약한불로 줄여주세요. 계란 흰자부터 붓고 끝에서 부터 돌돌 말아주세요.%<p class=""step_add add_fire"">약불</p>%<p class=""step_add add_tip2"">야채는 한군데 뭉치지 않고 고르게 잘 펴지게 해주세요.</p>%끝까지 돌돌 말고 팬 빈공간에 다시 기름을 살짝 두르고 키친타올로 닦아서 팬에 살짝 묻어있는 정도만 남겨주세요.%빈공간에 남은 흰자를 또 붓고 이어서 말아줍니다. 계란을 이을때 말아두었던 계란과 새로부은 계란 사이에 틈이 있을경우 계란말이가 끊기니 사진처럼 빈공간이 없도록 계란물을 채워주세요.%위과정을 반복하며 말아주고 흰자를 다 썼으면 노른자를 흰자에 이어 부어 말아줍니다.%흰자보다 노른자 양이 적어서 부족할수 있으니 알뜰이 주걱 같은걸로 싹싹 긁어서 알뜰하게 사용해주세요.%끝까지 돌돌 말아주고 팬 벽면에 붙여서 뒤집개로 살짝 눌러서 각을 잡아줍니다.%좁은양옆면은 이렇게 세워서 각을 잡아주세요.%완성된 계란말이는 도마로 옮기고 충분히 식혀줍니다. (식힌다음에 잘라야 모양이 깔끔하게 잘 나와요)%가로 양쪽면이 케이크 뒷면이 되도록 사진처럼 잘라줍니다.%마지막으로 데코!! 케찹으로 동그랗게 짜주고~%작은 어린잎을 올려 데코해주세요.%완성!",모험추구형
냉파요리로 좋은 5분완성 떠먹는 컵피자 만들기,1인분,5분 이내,아무나,6894872,빵,기타,초스피드,식빵%제과/제빵%1장&양파%채소류%1/4개&샌드위치햄%가공식품류%2장&캔옥수수%곡류%2T&모짜렐라 치즈%달걀/유제품%적당히&파슬리가루%기타%톡톡&토마토 스파게티 소스%기타%적당히&,"먼저 식빵을 가위로 잘게 잘라 줍니다.%양파 햄 캔옥수수등 토핑재료도 잘게 썰어 준비합니다%<p class=""step_add add_tip2"">토핑재료는 버섯이나 파프리카등 본인 기호에 맞게 추가해주세요</p>%머그컵 밑부분에 식빵을 깔아 주고 그 위에 양파 햄 콘옥수수를 깔아 줍니다.%토마토 스파게티 소스를 골고루 펴 발라주시고 모짜렐라 치즈를 올리고 파슬리가루 솔솔 뿌려줍니다. 이 상태로 전자렌지에서 치즈가 녹을때까지 약 2-3분 돌려주심 끝!%냉파요리로 좋은 5분완성 떠먹는 컵피자 완성입니다^^%한입 먹어보니 고소한 치즈에 스파게티 소스 토핑 재료들이 한데 어우려져 넘 맛있어요!특히 냉장고속 자투리 재료들을 맛있게 처리할수 있어 참 좋습니다!",간편추구형%합리추구형
No밀가루!속이 편안 밥피자 만들기,2인분,30분 이내,아무나,6895266,밥/죽/떡,굽기,영양식,밥%쌀%1공기&계란%달걀/유제품%1개&버터%기타%1T&양파%채소류%1/2개&피망%채소류%1/2개&햄%가공식품류%1/2캔&피자치즈%달걀/유제품%1봉&파슬리가루%기타%톡톡&토마토스파게티소스%기타%적당히&,"먼저 야채와 햄을 잘게 썰어 준 뒤 달궈진 팬에 식용유 약간 둘러 볶아 줍니다.%밥에는 계란1개를 깨서 잘 섞어 둡니다.%달궈진 팬에 버터 1스푼을 둘러 녹여 주시구요%<p class=""step_add add_fire"">약불</p>%계란 섞은 밥을 넓게 펴서 올린 뒤 이 상태로 타지않게 약불에서 3분정도 익혀줍니다.%<p class=""step_add add_fire"">약불</p>%밥이 어느정도 익으면 볶아둔 재료 올리고 스파게티 소스를 얇게 발라 줍니다.%<p class=""step_add add_tip2"">불은 계속 약불 유지!</p>%피자치즈 파슬리가루를 뿌린뒤 뚜껑을 덮어 약불에서 치즈 녹여주시면 끝!%<p class=""step_add add_tip2"">타지 않게 약불에서 치즈를 녹여 주셔요.</p>%밀가루가 없어 속이 편한 밥피자 완성입니다!%한조각 먹어보니 밥은 약간 누룽지처럼 바삭하면서 야채 햄 고소한 치즈가 어우러져 진짜 맛있어요! 밀가루 없어 속이 편하면서도 든든해서 한끼 식사대용으로도 좋아요",합리추구형%모험추구형
노오븐 브라우니 만들기 (따뜻한 겨울 간식 초간단),1인분,5분 이내,초급,6904938,디저트,기타,초스피드,밀가루%제과/제빵%1/4컵 (약18g)&설탕%기타%1/4컵 (약18g)&코코아파우더 or 제티%기타%2스푼(밥숟가락 기준)&식용유%기타%2스푼(밥숟가락 기준)&우유%달걀/유제품%1/4컵&슈가파우더 (선택사항)%기타%적당량&,컵에 준비한 밀가루를 넣어주세요 (체를 쳐서 넣으면 더 섞기가 쉬워요^^)%준비 된 설탕도 넣습니다 (단걸 좋아하신다면 원래 레시피에서 설탕 2~3스푼정도를 추가하셔도 될것 같아요!!)%코코아파우더나 제티 (핫초코 가루)도 2스푼 넣어주세요 (밀가루와 마찬가지로 체를 치면 더 편하겠죠?)%이제 식용유를 2스푼 넣습니다 (녹인버터를 사용하셔도 되요!!)%준비된 우유를 넣고 잘 섞어주세요%이제 전자레인지에 넣고 1분간 돌린 후 10초씩 3번 돌려주세요 (총 1분 30초)%마지막으로 데코용 슈가파우더를 뿌려주시면 완성입니다!! 슈가파우더는 꼭 뿌리지 않으셔도 되요^^%맛있게 드시면 됩니다♥ 따뜻할때 우유랑 드시면 정말 맛있어요~,간편추구형%모험추구형%합리추구형
일본식 두부 덮밥 두부 소보로동 만들기,1인분,30분 이내,중급,6829153,밥/죽/떡,볶음,일상,두부(부침찌개용)%콩/견과류%300g 한 팩&간장%기타%2T&설탕%기타%2T(취향에 따라 가감)&미림%기타%1T&생강파우더%기타%1꼬집 or 생강 다진 것%기타%1/2t&후추%기타%약간&참기름%기타%1t&대파 흰대 다진 것%기타%1T&,간장 설탕 미림 생강은 섞어둔다.%두부는 그릇에 담아 %전자레인지에 2분간 돌리면 요렇게 수분이 나온다. 물기는 따라 버리고 준비.%팬에 참기름을 두르고 파 다진 것을 넣고 향을 내고 %두부를 넣고 으깨가며 볶는다. (미리 손으로 으깨서 넣어도 됨)%불은 중불 정도로.%볶볶.%요렇게 물기가 웬만큼 날아가고 두부가 적당한 크기가 되면%만들어둔 소스를 붓고 조린다. 나는 두반장 넣을거라 소스를 덜 넣음.%잘 뒤적거리면서 볶는다.%두반장 넣을 사람은 넣고 %후추 넣어 마무리!%요렇게 물기가 없어질 때까지 볶으면 된다.%그릇에 밥!%두부 소보로!%온천달걀 초생강 파를 고명으로 올렸다.,모험추구형
[간단 자취요리] 미친 매운맛! 빨간오뎅 집에서 만들어 먹기! / Spicy fish cakes,4인분,30분 이내,아무나,6860267,메인반찬,조림,술안주,어묵%가공식품류%8장&물%기타%200ml(약 종이컵4/5컵)&고추%기타%2개&고추장%기타%5T&간장%기타%2T&설탕%기타%4T&다진마늘%기타%1T&,"재료를 준비합니다.%<p class=""step_add add_material"">어묵 물 고추 고추장 간장 설탕 다진마늘</p>%고추 1개는 썰고 1개는 다져줍니다. 다질 것은 씨를 제거해줍니다.%나머지 하나는 어슷 썰어주세요.%이제 꼬치에 어묵을 끼워줍니다. 저는 한 꼬치에 어묵을 2개씩 끼웠어요!%팬에 물과 양념들을 넣어줍니다.%<p class=""step_add add_material"">양념 재료 : 물 고추장 간장 설탕 다진마늘</p>%꼬치에 끼운 어묵을 넣어줍니다.%<p class=""step_add add_tip2"">고루 뒤집어가며 조려줍니다.</p>%어슷 썬 고추도 넣고 마저 조려주세요.%마무리로 다진 고추를 얹어주면 끝!",모험추구형
"에어프라이어/전자렌지로 만든 ""모닝계란빵""♪",3인분,30분 이내,아무나,6908683,빵,굽기,간식,모닝빵%제과/제빵%6개&계란%달걀/유제품%6개&스팸%가공식품류%1/4조각&마요네즈%기타%&소금%기타%&파슬리가루%기타%&계란%달걀/유제품%3개&마요네즈%기타%1스푼&스팸 다진것%기타%약간&자투리 모닝빵%기타%적당량&소금약간%기타%&,"우선 모닝빵을 준비합니다. 모닝빵 혹은 디너롤이라는 이름으로 파는 동그란 모양의 빵이면 됩니다.%스팸도 약간 다져서 준비하구요~ 스팸/햄/베이컨 등등 있는 재료로 취향껏 준비해주세요.%모닝빵의 윗부분을 칼로 살짝 잘라내주세요.%손가락을 이용해 모닝빵속을 구멍이 안뚫리게 살살 뜯으며 파냅니다. 계란1개가 들어갈 공간이면 충분합니다.%속을 파낸 모닝빵에 마요네즈 살짝 짜서 넣구요~%티스푼을 이용해 속에 대충 펴발라줍니다.%그리고 계란을 한개씩 깨트려 모닝빵 속에 넣어주세요.%<p class=""step_add add_tip2"">모닝빵의 크기도 계란의 크기도 각각 달라서 <br> 계란이 흘러 넘칠 수도 있는데요.<br> E마트에 디너롤이라는 이름으로 <br> 24입 들어있는거 파는거 있어요.<br> (가격은 2 580원)<br> 홍보는 아니고..^^ <br> 이게 크기가 커서 계란이 넉넉하게 들어가고공간도 여유있어요^^;;</p>%노른자는 열을 가하면 터질수도 있으니까 포크를 이용 살짝 터트려 줍니다.%계란 위에 소금간을 조금씩 한 다음 스팸 다져놓은거 1tea스푼씩 넣고 파슬리가루를 뿌려줍니다.%이제 에어프라이어를 준비 모닝계란빵을 가지런히 담아줍니다. 160도로 온도를 맞춘 다음 15분간 돌려줍니다. 반숙이 좋으면 15분으로 끝내시고 완숙이 좋으면 5분간 추가로 더 돌려주세요.%완성된 모닝계란빵!!%그리고 모닝계란빵 총6개 중에 4개만 에어프라이어에 돌렸고 2개는 전자렌지에 돌렸는데요 전자렌지에 1분30초 돌려줍니다.%1분30초뒤에 완성된 모닝계란빵!!%전자렌지에 돌린건 쫄깃한 맛이구요~ 에어프라이어에 돌린건 바삭하고 부드러운맛이라서 개인적으로는 에어프라이어에 만드는걸 추천드려요!!%<p class=""step_add add_tip2"">한 입 베어물때 바사삭 거리는 식감으로 인해<br> 모닝계란빵을 더 맛있게 먹을 수 있는건 <br> 에어프라이어 입니다.</p>%마지막으로 모닝빵 속을 파내고 나온 빵들..요것도 계란빵으로 변신시켜 줄건데요~%모닝빵 자투리에 계란3개 마요네즈1스푼 스팸다진거 소금약간 뿌려 준비합니다.%숟가락으로 잘 섞어주기~%전자렌지 사용이 가능한 용기를 준비하구요~ 용기 안에 식용유 살짝 발라줍니다.%잘 섞어놓은 재료를 부어주고요 파슬리가루도 살짝 뿌려줍니다.%그리고 랩을 씌워서 전자렌지에 2분간 돌려주기.%<p class=""step_add add_tip2"">전자렌지 사양이 틀리니 <br> 한번에 돌리기 보단<br> 1분/1분 혹은 1분30초/30초..<br> 이렇게 나눠서 돌리긴 권장합니다.</p>%완성된 자투리 계란빵.%한 김 식으면 접시에 옮겨담고 먹기 좋게 썰어주면 이것도 별미로 맛나답니다.",합리추구형
