딱 10분이면 완성! 초간단 애호박덮밥,1인분,10분 이내,아무나,6886567,밥/죽/떡,볶음,초스피드,밥%쌀%1공기&애호박%채소류%1/2개&양파%채소류%1/3개&기름%기타%1T&고추기름%기타%1T&다진파%기타%1줌&참기름%기타%1t&고춧가루%기타%1T&고추장%기타%0.5T&간장%기타%2T&물%기타%2T&굴소스%기타%1T&다진마늘%기타%0.5T&후추%기타%톡톡&,"양파와 애호박은 채 썰어 준비해 주세요.%<p class=""step_add add_material"">양파 1/3개 애호박 1/2개</p>%<p class=""step_add add_tip2"">전 애호박을 넉넉하게 준비했어요~ 취향껏 양을 조절해주세요. </p>%분량의 양념 재료를 섞어 양념장을 만들어 주세요.%<p class=""step_add add_material"">고춧가루 1T 고추장 0.5T 간장 2T 물 2T 굴소스 1T 다진마늘 0.5T 후추 톡톡</p>%<p class=""step_add add_tip2"">양념 재료는 취향에 따라 가감해주세요.</p>%팬에 기름 1T 고추기름 1T를 넣고 다진파 한줌 넣어 약불에서 파기름을 만들어 주세요.%<p class=""step_add add_material"">기름 1T 고추기름 1T 다진파 한줌</p>%<p class=""step_add add_fire"">약불</p>%<p class=""step_add add_tip2"">고추기름이 없다면 그냥 기름을 사용하셔도 좋아요. </p>%파향이 올라오면 센불로 올리고 양파와 애호박을 넣어 약 2-3분간 볶아주세요.%<p class=""step_add add_material"">양파 애호박</p>%<p class=""step_add add_fire"">센불</p>%그 다음 양념장을 넣어 약 2-3분간 볶아주세요.%<p class=""step_add add_material"">양념장</p>%<p class=""step_add add_fire"">센불</p>%<p class=""step_add add_tip2"">양념장이 튈 수 있으니 조심하세요.<br> 양념장은 넣기 전에 맛을 보고 너무 짜다 싶으면 다 넣지 말고 입맛에 맞게 넣어주세요. </p>%채소가 다 익으면 불을 끄고 마무리로 참기름 1t를 넣으면 완성입니다.%<p class=""step_add add_material"">참기름 1t</p>%<p class=""step_add add_tip2"">혹시 부족한 간은 소금으로 맞춰주세요.<br> </p>%그릇에 밥과 애호박볶음을 올리고 취향에 따라 달걀후라이를 하나 함께 곁들이시면 완성업니다:)",간편추구형%합리추구형
표고버섯달걀죽 - 아침식사로 좋으네 달걀죽,1인분,30분 이내,아무나,6857631,밥/죽/떡,끓이기,일상,표고버섯%버섯류%5개&달걀%콩/견과류%2개&밥%쌀%1공기&멸치육수%기타%5컵&참기름%기타%2&국간장%기타%1&소금%기타%&,표고버섯은 채썰어 주고 달걀은 2개 풀어서 준비%냄비에 참기름1을 두르고 표고버섯을 2분정도 달달 볶아주고 그 뒤 공기밥1을 넣어 볶고%멸치육수 5컵을 부어주고 바닥에 눌러 붙지 않게 저어가며 끓여주고 불은 중불로~%밥 알이 퍼지면%달걀물을 돌려가며 넣어주고 고루 섞어 줍니다. 2분정도%국간장1으로 간을 하고 부족한 간은 소금으로 해주심 되요. 마지막으로 참기름1을 넣어 마무리 해주세요.,건강/안전추구형
신전보다 맛있는 스팸마요 덮밥,1인분,10분 이내,초급,6929691,밥/죽/떡,볶음,초스피드,스팸%가공식품류%1/2개&계란%달걀/유제품%1개&마요네즈%기타%취향껏&김%기타%취향껏&진간장%기타%4스푼&물%기타%4스푼&설탕%기타%2스푼&,"스팸은 작은크기로 깍뚝 썰기해서 팬에 노릇하게 구워 준비해주세용%<p class=""step_add add_fire"">약불</p>%계란은 잘풀어 스크램블을 만들어 준비해줍니당%<p class=""step_add add_fire"">약불</p>%간장4 설탕2 물4스푼을 팬에 넣고 15초간 졸여 주세용%<p class=""step_add add_fire"">약불</p>%<p class=""step_add add_tip2"">불을 끈 후에도 금방 걸쭉해지니 너무 많이 끓이지는 마세용^^</p>%밥한공기에 계란과 스팸을 얹고 소스를 넣은후 마요네즈를 취향껏 뿌려 줍니다. 김가루도 얹어주면 꿀맛♡♡",간편추구형%합리추구형
부타동 만큼이나 맛있는 초간단 베이컨덮밥,1인분,15분 이내,초급,6933624,밥/죽/떡,볶음,일상,베이컨%가공식품류%100g&밥%쌀%1그릇&양파%채소류%1/2개&계란 노른자%달걀/유제품%1개&설탕%기타%1큰술&간장%기타%1큰술&맛술%기타%1큰술&굴소스%기타%1/2큰술&다진마늘%기타%1/2큰술&,먼저 소스부터 만들어주세요. 설탕 1큰술 간장 1큰술 맛술 1큰술 굴소스 1/2큰술 다진마늘 1/2큰술을 넣고 잘 섞어주세요.%베이컨 100g 정도 준비해서 먹기 좋은 크기로 썰어주세요. 양파 1/2개는 잘게 채썰어줍니다.%중불에 달군 프라이팬에 식용유를 두르고 베이컨을 넣고 노릇하게 볶아주세요.%베이컨이 익으면 준비한 소스와 양파를 넣고 양파가 반투명하게 익을때까지 볶아줍니다.%뜨거운 밥위에 양념에 볶은 베이컨을 올리고 계란 노른자 1개 올린 뒤 파슬리 가루 솔솔 뿌려주면 완성!,간편추구형%합리추구형
초간단 깻잎두부구이,2인분,30분 이내,아무나,6863696,밑반찬,굽기,일상,간장%기타%2숟가락&맛술%기타%1숟가락&참기름%기타%1/2숟가락&통깨%기타%1숟가락&깻잎%채소류%3장&,두부는 먹기좋게 잘라주세요%소금 후추를 솔솔 뿌려 5분정도 놓아둔후에 키친타올로 물기를 제거해주세요%비닐봉투에 튀김가루를 넣어 물기제거한 두부에 튀김가루를 묻혀주세요 튀김가루대신 전분이나 밀가루를 이용하셔도 좋아요 근데 튀김가루나전분이 바삭하니 더 맛나답니다 %<br>%달군팬에 기름을 두른후에 두부를 튀기듯 노릇하게 구워주세요%노릇노릇 이정도가 되면 잘 구워진거랍니다~ 밑면에 바삭바삭하답니다.. 불은 중약불로해서 구워주세요 %<br>%깻잎은 깨끗이 씻어 꼭지를 떼고 돌돌말아 채썰어주세요%양념재료를 모두 넣어주시고 깻잎도 넣어 섞어주세요 그릇에 구운두부를 담고 깻잎간장을 올려주시면 되는데요 손님초대요리로도 좋고 반찬 안주로도 좋을거 같아요,합리추구형
여름에 잘 어울리는 미역초샐러드! 와사비 넣어 더 상큼하게,1인분,30분 이내,아무나,6891823,샐러드,무침,다이어트,미역%수산물%5g(1인분)&오이%채소류%1/2개&양파(작은것)%채소류%1/2개&통깨%기타%조금&간장%기타%5스푼&물%기타%5스푼&식초%기타%3스푼&설탕%기타%1스푼&연와사비%기타%취향껏&냉동새우%수산물%4-5마리&미림%기타%1스푼&해물믹스%수산물%적당량&,"오이는 굵은 소금을 발라 깨끗이 씻어주고 냉동새우살은 물에 담가 해동해주세요 미역은 자른 미역으로 준비해요%양파는 최대한 얇게 썰어주시고 오이는 반달모양으로 썰어주세요%<p class=""step_add add_tip2"">양파는 찬물+식초 두2~3방울에 담가 아린맛을 제거해주는게 좋습니다 </p>%미역을 물에 불려줍니다%해동한 냉동새우살은 맛술(미림)을 살짝 둘러주어 비린맛을 없애주세요%새우살을 2~3분간 데쳐주고%불린 미역도 2분 정도 데쳐 찬물에 헹구워줍니다%간장5스푼 물 5스푼 식초 3스푼 설탕1스푼에 와사비를 취향껏 넣어 드레싱을 만들어 줍니다%준비된 재료들을 한데 넣고 드레싱을 부어가며 버무려주면 완성! 접시에 낼땐 통깨를 뿌려주세요",건강/안전추구형%모험추구형
돼지목살꼬치 아이간식과 남편 술안주로 딱이야~,2인분,20분 이내,초급,6904344,디저트,조림,간식,돼지고기 목살%돼지고기%300g&후추%기타%톡톡&돈가스 소스%기타%1.5큰술&굴소스%기타%1큰술&설탕%기타%0.5큰술&맛술%기타%1큰술&물%기타%2큰술&,집에 목살이 있어서 만들었지만 다양한 부위로 활용해도 좋을 듯%기름 부위를 다 제거하고 살코기만을 사용했는데 기름 부위의 고소한 맛을 좋아한다면 그냥 만들어도 좋다%꼬치에 끼울 수 있게 잘라주고 트위스트로 끼워준다%꼬치에 고기를 트위스트로 끼워주기%자투리 고기들도 코치에 모두 끼우고 후추 톡톡!%예열된 냄비에 오일을 두르고 구워주기%뚜껑을 닫고 중불에 구워주면 고기에서 수분이 생겨 타거나 냄비 바닥에 눌어붙지 않고 잘 익혀진다%중간중간 뚜껑을 열어 확인해보고%꼬치에 한쪽 면이 다 익혀졌을 때 뒤집어서 반대쪽도 익혀준다%냄비 뚜껑을 닫고 타지 않게 중약 불로 고기가 다 익을 때까지 익혀준다%고기가 익는 동안 소스를 만들고%다 익은 고기에 소스를 부어가며 졸여준다%한 번씩 뒤집으며 고기에 양념이 잘 베이게 졸여주기%소스가 졸여지면서 고기에 잘 묻어 날 수 있게 구워 주면 끝 쪽파를 송송 썰어서 뿌려주니 더 먹음직스럽다~,건강/안전추구형%합리추구형
새우살로 만드는 얼큰한 새우탕 만들기,2인분,60분 이내,아무나,6902441,국/탕,끓이기,일상,냉동 새우살%수산물%200g&양파%채소류%1/2개&애호박%채소류%1/2개&대파%채소류%1대&청양고추%기타%2개&다시마%기타%3장&멸치%기타%7~10개&물%기타%1L&된장%기타%1큰술&다진 마늘%기타%1큰술&고춧가루%기타%2큰술&액젓%기타%1큰술 []&,"· 멸치 다시 육수를 끓여줍니다 ( 저는 집에 다시팩이 있어서 넣어줬습니다 )%<p class=""step_add add_tip2"">- 다시마 3장 멸치 7~10개 물 1L<br> 넣고 끓이다가 물이 끓으면 다시마만 뻬 주고 7~10분간 더 끓여주세요</p>%· 냉동새우살은 흐르는 물에 2~3번 씻어내준 뒤 체에 밭쳐 물기를 빼 줍니다%· 양파 채 썰고%대파는 쫑쫑 썰어줍니다%· 애호박은 반달썰기로 썰어주고%취향에 따라 청양고추도 썰어줍니다%· 육수가 준비가 되면 양파와 애호박 먼저 넣고%· 된장 1 큰 술 다진 마늘 1 큰 술 고춧가루 2 큰 술 넣고 골고루 풀어주며 끓여주다가 양념이 골고루 풀어지면 새우와 대파 청양고추를 넣어줍니다%· 약 5분간 더 끓여주다가 간을 보고 액젓으로 간을 해줍니다%<p class=""step_add add_tip2"">- 액젓 향을 싫어하시는 분들은 국간장으로 간해주세요</p>%끓으면서 나오는 거품은 걷어주세요 :)%완성!!!%새우살로 만드는 간단하고 시원 얼큰한 새우탕",건강/안전추구형%합리추구형%모험추구형
[간단 자취요리] 혼술 안주 생성! 닭꼬치 만들기,3인분,30분 이내,아무나,6867736,디저트,굽기,술안주,닭고기%닭고기%1그릇&대파%채소류%&간장%기타%1T&후추%기타%&간장%기타%2T&굴소스%기타%2T&설탕%기타%2T&다진마늘%기타%1T&물%기타%2T&,"재료를 준비한다.%먼저 닭에 밑간을 해 준다.%<p class=""step_add add_tip2"">닭은 다리살이나 가슴살을 준비해주세요. </p>%파를 한 입 크기로 썰어준다.%손질한 닭과 파를 꼬치에 골고루 꽂아준다.%양념장을 만든다.%<p class=""step_add add_tip2"">맛술 있으면 맛술도 2T 없으면 생략! </p>%팬에 기름을 두르고 꼬치를 구워준다.%고기가 익으면 약불로 줄이고 양념을 발라준다.%뒤집어가며 골고루 양념을 발라 구워준다.",합리추구형
마늘조림 건강한 밑반찬 애들이 더 좋아해요 ~,4인분,30분 이내,아무나,6874797,밑반찬,조림,일상,마늘%채소류%40알정도&식용유%기타%2큰술&물%기타%3큰술&간장%기타%3큰술&꿀%기타%1.5큰술&참기름%기타%1/2큰술&통깨%기타%약간&,마늘은 밑둥 부분을 칼로 잘라주시고 먹기좋은 크기로 잘라주시면 되는데요 저는 반정도만 잘라주고 좀 더 큰건 세번정도 나눠서 잘라 준비해줬어요%그리고 팬에 식용유 2큰술 정도 둘러주시고 마늘 겉면이 노릇노릇해질 정도로 볶아주세요 ~%마늘 겉면이 노릇하게 변하면 참기름을 제외한 나머지 분량의 양념을 넣어주시면 되요 물 3큰술%간장 3큰술%꿀 1.5큰술을 넣어주세요 단거 싫어하시면 1큰술만 넣으셔도되요%그리고 마늘에 색이 어느정도 베일정도로 졸여주세요%양념이 어느정도 졸아들었을때 마지막 참기름 1/2큰술을 넣고 통깨 톡톡 뿌려 마무리 해주시면 된답니다 ^^%통깨 톡톡 뿌려 마무리 해주시면 된답니다 ^^,건강/안전추구형%합리추구형%모험추구형
오븐없이 만드는 갈릭버터치즈피자,2인분,10분 이내,아무나,6853446,빵,굽기,간식,또띠아%제과/제빵%2장&버터%기타%1수저&다진마늘%기타%1수저&꿀%기타%1수저&피자치즈%달걀/유제품%적당량&,다진마늘 한큰술에%버터 한 큰 술을 넣어 전자레인지에 10초 돌려주세요~^^%녹은 버터와 마늘을 잘 섞어 준비%녹은 버터와 마늘을 잘 섞어 준비%토르티야에 마늘 버터를 잘 발라주고~%한장더 발라주면 끝%치즈를 가장자리는 비우고 골고루 뿌려주면 완성~! 준비하는데 5분도 안 걸린다지요^^%전자레인지에 3~4분 돌려주면 끝! 집집마다 전자레인지의 효력은 조금씩 다를 테니 조절하셔요^^%잘구워진 버터갈릭치즈피자완성%가위로 먹기 좋게 잘라~ 꿀과 함께 내어내면 끝~!,간편추구형%모험추구형%합리추구형
오징어 야채전~*,2인분,15분 이내,아무나,6860289,밑반찬,부침,일상,오징어%수산물%1/2마리&양송이버섯%버섯류%2송이&양파%채소류%조금&당근%채소류%조금&대파%채소류%조금&솔트(소금)%기타%톡톡(두꼬집)&,손질된 오징어를 잘게 썰어주세요%양송이버섯?양파?대파?당근 다져주세요%계란 1개 탁~~ 넣어주시고%부침가루 1큰술 넣어 줍니다%슥슥~~ 잘 버무려 주시고%기름을 넉넉히 두르고 예열된 팬에 한큰술식 떠 올려 줍니다%앞?뒤 노릇 노릇하게 구워주시고%그릇에 담아 내심 맛있는 오징어 야채전 끝입니다^^ 맛있게 �y �y~~,간편추구형%건강/안전추구형
매콤하게 즐기는 새우당면 덮밥,2인분,30분 이내,초급,2399193,밥/죽/떡,볶음,일상,불린 당면%면%1줌(150g 정도)&새우%수산물%20마리&양파%채소류%1/2개&대파%채소류%1/2대&다진마늘%기타%1큰술&고추기름%기타%1큰술&참기름%기타%1큰술&멸치다시마물%기타%1/2컵&설탕%기타%1/2큰술&고추장%기타%1큰술&굴소스%기타%1큰술&맛술%기타%2큰술&후추%기타%약간&,당면은 미지근한 물에 20~30분 정도 불려준비하세요.%양념재료는 미리 섞어서 준비하세요.%팬이 달궈지기 전에 고추기름과 다진마늘을 넣고 향을 내며 볶아주세요.%팬이 달궈지면 새우와 양파를 넣고 볶아주세요.%새우가 익으면 당면과 파를 넣고 당면이 투명하게 익을 때까지 볶아주세요. 당면이 너무 길면 먹기가 불편하니깐 정당히 잘라 넣으면 좋아요.%양념을 붓고 잘섞은 다음 바글바글 끓여 잘어우러지면 참기름을 둘러 섞은 다음 불을 끄고 밥에 얹어내세요.,모험추구형%합리추구형
두부강정 만드는 법 아이들이 좋아하는 반찬!!,2인분,30분 이내,초급,6872334,밑반찬,튀김,일상,두부%콩/견과류%1/2모&부침가루%기타%1/2컵&케찹%기타%3큰술&설탕%기타%1큰술&올리고당%기타%2큰술&간장%기타%2큰술&다진마늘%기타%1큰술&,"두부는 먹기좋은 크기로 잘라주세요. 아이들이 먹을꺼라 전 좀 작게 잘라줬어요. 한입에 쏙 들어갈 크기로 깍뚝썰기 해줬답니다.%그리고 키친타올 위에 올려두고 두부를 올려서 물기를 어느정도만 제거해주세요.%그다음 비닐봉지를 이용해서 두부에 부침가루를 묻혀줄껀데요. 그냥 하나하나 묻혀주시는것보다 비닐봉지를 이용하시면 더욱 쉽게 묻히실수 있어요. 전 부침가루 1/2컵 정도를 비닐봉지에 넣어서 두부에 부침가루가 골고루 묻도록 흔들어줬어요. 부침가루가 없으시다면 전분가루나 밀가루를 사용하셔도 괜찮아요~ 전 집에 부침가루만 있어서 부침가루를 사용했어요.%기름을 적당히 두른팬에 부침가루 골고루 묻은 두부를 익혀주세요~%두부 겉면이 노릇노릇하게 익을때까지 구워주시면 되는데요. 전 좀 바삭한 식감을 위해서 약한불에서 겉면이 바삭해지도록 오랫동안 익혀주었어요~%두부를 익혀주는 동안에 두부강정 양념소스를 준비하시면 되는데요. 케찹 3큰술 설탕 1큰술 올리고당 2큰술 간장 2큰술 다진마늘 1큰술 분량의 양념을 한곳에 모아 섞어서 준비해주세요.%노릇노릇 바삭한 식감으로 잘 구워진 두부를 키친타올에 올려서 기름기를 어느정도 제거해주세요.%그리고 만들어둔 양념은 후라이팬에 넣고 살짝 끓어오르면 불을 꺼주세요.%<p class=""step_add add_tip2"">불을 계속 켜두면 양념이 탈수있으니 불을 끄고나서 두부랑 양념해주시는게 좋답니다.</p>%양념이 끓어오를때 두부를 넣고 불을 꺼주었어요.%그리고 양념으로 두부에 골고루 묻도록 양념해주시면 된답니다. 통깨가 있으시면 통깨로 살짝 마무리 해주셔도 좋아요.",합리추구형
모닝빵콘치즈 간단간식,2인분,30분 이내,아무나,6881806,디저트,굽기,일상,모닝빵%제과/제빵%6개&옥수수 콘%곡류%1컵&마요네즈%기타%1스푼&허니 머스터드%기타%1스푼&후춧가루%기타%약간&피자치즈%달걀/유제품%70g&,볼에 캔 옥수수 1컵을 담고(이때 물기를 빼주세요) 마요네즈 1 허니 머스터드 1 후춧가루 약간 넣어 섞어 줍니다.%다시 피자치즈 70g을 넣고 고루 섞어주기%모닝빵 6개를 준비하고 윗부분을 잘라 속을 파줍니다. 가운데 속을 파는 건 아이들에게 시켜주시면 돼요. 함께 준비하는 간식 ^^ 파낸 속은 자기 입속으로~~~ ㅋㅋㅋ%버무려 놓은 옥수수를 모닝빵 속에 채워 넣어주세요. 그리고 오븐 180도에서 15분 정도 구워 주면 됩니다. 오븐이 없을 경우 전자레인지 사용하심 되는데요. 오븐에 구워주면 빵이 바삭하지만 전자레인지를 사용하면 바삭함은 없어요.%모닝빵 콘치즈 완성 ^^ 반으로 자르면 옥수수랑 치즈가 사이좋게 딱 붙어서 쭈~욱 눌어나고 쫀득하니 너무 맛나요,모험추구형%합리추구형
출출할때 필요한 꿀 떨어지는 허니윙 ★,3인분,30분 이내,아무나,6924155,퓨전,조림,간식,닭날개%닭고기%18개&견과류%콩/견과류%약간&맛술%기타%1숟가락&올리브유%기타%1숟가락&소금%기타%약간&후추%기타%약간&바질%기타%약간&간장%기타%3숟가락&다진마늘%기타%1숟가락&꿀%기타%3숟가락&맛술%기타%2숟가락&후추%기타%약간&,닭날개의 칼집을 낸 후 밑간 재료를 넣고 10분간 재운다.%볼에 소스 재료를 넣고 섞어 소스를 만든다.%팬에 올리브유를 두른 후 밑간한 닭날개를 앞뒤로 굽는다.%닭날개가 노릇하게 구워졌으면 소스를 넣고 소스가 졸아들때까지 약불로 졸인다.%접시에 닭날개를 올린 뒤 다진 견과류를 뿌려 완성한다.,건강/안전추구형%합리추구형%모험추구형
일본식 오이무침,2인분,30분 이내,아무나,6937067,밑반찬,무침,일상,오이 &amp;백오이%채소류%2개&다진양파%기타%1개&다진마늘%기타%2Tablespoon&간장%기타%1T&설탕%기타%2t&식초%기타%2t&레드페퍼 or땡초%기타%조금&참기름%기타%1t&,오이를 깨끗히 씻어서 준비해주시고 양쪽 끝은 제거해주세요. 일회용 나무젖가락을 오이바깥부분에 두고 썰어줍니다. (전요즘 백오이로 많이해요ㅎ)%최대한 얇게 하셔도 되지만 상관없으시다면ㅎ두껍게 하셔도 되요..얇게하시면 더 이뻐요ㅎ 다 썬 후 3등분이나 4등분해주세요%소금물을 준비해주시고 30분정도 절이겠습니다. 사진과 같이 오이가 유연해질 정도만 절여주시면 되용.%다 절인후 키친타올로 물기를 제거해주세요. 다진양파 다진마늘에 양념을 넣고 잘 섞어줍니다. 양파와 마늘 양은 개인의 취향에 맞게 조절해주시고 양념도 새콤달콤 조절은 개인적인 입맛에 맞춰주세요.%물기를 제거한 오이와 양념을 지퍼팩에 넣은후 잘섞어주세요.%사진과 같이 양파와 마늘이 고루 잘어울어지게 손으로 좀 만져주세요.%실온 1시간 후 냉장보관하고 꺼내어 드시면 됩니다. 먹기 편하시려면 위에서 소금절이기전에 3등분 말고 한입크기로 컷팅하셔도 되요~,건강/안전추구형%모험추구형%합리추구형
고소함이 남다른 백종원 '들기름계란후라이'초간단 레시피,2인분,10분 이내,아무나,6898369,밑반찬,부침,초스피드,계란%달걀/유제품%3개&들기름%기타%3T&대파%기타%1대&국간장%기타%1/2T&통깨%기타%솔솔&,"먼저 대파를 잘게 썰어 줍니다.%달궈진 팬에 들기름3스푼 둘러 주세요%<p class=""step_add add_tip2"">*들기름 양은 사용하는 계란 갯수만큼 맞쳐 주시면 적당할것 같아요 (예:계란5개-들기름5T)</p>%들기름에 대파를 달달 볶아 줍니다. 대파향이 어느 정도 나게 볶아 주세요%대파위에 계란3개를 깨서 반숙으로 익혀 주셔요%<p class=""step_add add_tip2"">반숙 싫으시면 노른자 톡 터트려 주세요</p>%계란후라이 담을 접시에 국간장 1/2스푼 뿌려 주시구요. 이제 접시 위에 계란 후라이 담아주고 통깨 솔솔 뿌려주심 끝!%<p class=""step_add add_tip2"">국간장을 계란후라이 위에 뿌리셔도 되는데 깔끔한게 좋아 아래에 뿌렸어요</p>%고소함이 남다른 밥도둑 반찬 백주부님 '들기름계란후라이'완성입니다. 한입 먹어보니 고소한 들기름에 대파향이 쏴악 감돌면서 넘 맛있어요. 김가루 좀 넣고 슥슥 비벼도 고소함 가득하니 꿀맛입니다",간편추구형%건강/안전추구형
간단하게~ 양송이 버섯 덮밥,4인분,30분 이내,아무나,6883228,밥/죽/떡,볶음,초스피드,양송이 버섯%버섯류%10줌&잔파%채소류%6대&다진마늘%기타%2큰술&물%기타%400ml&간장%기타%2큰술&굴소스%기타%1큰술&설탕%기타%1/3큰술&후춧가루%기타%약간&참기름%기타%1큰술&소금%기타%약간&통깨%기타%약간&전분%기타%2큰술&물%기타%2큰술&,"양송이 버섯은 기둥과 갓이 붙어 있는것으로 선택하구요. 마른 면보로 겉을 닦아 준비합니다.%<p class=""step_add add_tip2"">양송이버섯에 물이 닿으면 향이 떨어집니다.</p>%올리브유 3큰술 다진마늘 2큰술 중간불에서 마늘향이 나도록 볶아줍니다.%양송이 버섯을 넣고 (10줌) 함께 볶아줍니다.%양송이 버섯에 어느정도 기름이 스며들어 볶아지면 물 400ml (종이컵 2컵) 를 부어줍니다.%센불에서 물이 끓어오르면 중불로 줄이고 간장 2큰술 설탕 1/3큰술 후추 약간%굴소스 1큰술을 넣습니다.%잔파 6대를 5cm정도 썰어 넣고%녹말물(녹말 2큰술:물2큰술)을 넣어 점도를 조절합니다.%불을 끄고 참기름 1큰술을 넣고 간은 소금으로 마무리 합니다.%뜨끈한 밥위에 양송이 버섯을 올리고 통깨 솔솔~~뿌려주면 맛있는 양송이 버섯 덮밥이 완성됩니다.%적당하게 익은 양송이 버섯의 식감과 향이 간장소스에 잘 어우러져 밥이랑 함께 먹으니 눈 깜짝할 사이 밥 한그릇 뚝딱!!!! 특별한 반찬 없을 때 양송이 버섯 덮밥으로 간단하게 한끼 어떠세요?",건강/안전추구형
짭조름 간장 쏘야,2인분,30분 이내,아무나,6912270,밑반찬,볶음,초스피드,양파%채소류%1/3정도&파프리카%채소류%1/2개&비엔나소세지%가공식품류%2컵&물%기타%3컵&간장%기타%2&올리고당%기타%2&설탕%기타%1&후춧가루%기타%약간&,재료:양파1/3정도 파프리카반개 비엔나소세지2컵 물3컵 양념장:간장2 올리고당2 설탕1 후춧가루약간 밥숟가락계량입니다.%양파와 파프리카는 한입크기로 썰어놓고 비엔나소세지도 필요합니다.%끓는 물에 칼집낸 비엔나 소세지를 1분간 데쳐요. 기름이 둥둥 떠있네요.%중불로 달군팬에 식용유1큰술 두른 뒤 소세지를 노릇하게 볶아주세요. 물기를 제거해야 볶을 때 기름이 튀지않아요.%볶은 소세지에 야채와 양념장을 넣어 2분간 볶아줍니다.%간장을 넣어 짭조름한 간장 쏘야 볶음이 만들어졌어요. 2분간 볶아줘야 채소가 아삭하니 딱 좋아요.%아이와 어른들도 좋아하는 소세지볶음%간장 쏘야 볶음,합리추구형
